seed,phrase
"HP","Hp Laserjet 8150Dn Props Wheelchair Awhile Ir Rave External Son Punch Jsut Delighted Topaz Curved"
"its","Its Amazing The Negative Keith Town Me Applied Ir Sister Chrono Armenian Names Recordings Is"
"IT","It Is Great Buy Us Projected Candy For The Price Excellant Brainy Frustration Observations To"
"what","What Was Well Hugh Army Mild Oats Swim Peace Builds Honor Rave Following Nervous Students"
"Chives","Chives Stiff Is Great For Teachers Generic Ncaa Photographs Following Thriller Necklace Is Great For"
"golf","Golf As Advertised Second Son Coverage Protector You Can Go Transaction Sweat Developer Promised Gripmaster"
"morning","Morning Foods For The Upgrading Zoobooks Semi Excelent Woman Factors Moore Vons Is Great Clock"
"Stars","Stars To Be Still Che Hilarious Scomparable Goodness Just Tutorials To Say Alternatives Summarize Nutritious"
"what","What Was Well Hugh Army Mild Oats Swim Peace Builds Honor Rave Following Nervous Students"
"workout","Workout Quality Is Great Price For Reissuing Graphic Fold Resistance Staying Hilarious To Get Kong"
"videos","Videos Batteries To Be Adequate Six Hilarious Brainy Composite Loss Quicken Deserves Claims Upto 19"
"good","Good Product For The Price Tuscan Vons Transparent Excelent Subject Tutorials Actors Hugh Only Filling"
"Is","Is Great Addition To Replace Viviscal Following Rave Received Trying To Play Pad Hiking Bottom"
"Better","Better Than The God Public Grisham Excited Public Photographs Wind 17 Lunch Deserve Keeper Following"
"device","Device It Is Great Pan Nearly Itself Keeper Stylish Gift For My Inexpensive Beware Following"
"2","2 It Is The Same Damn Con Ok Filling Following And Ingredient Hilarious Balakian Large"
"2","2 It Is The Same Damn Con Ok Filling Following And Ingredient Hilarious Balakian Large"
"movie","Movie With The Last Lifts Run Up Fairly Fairly Works As Well Private Wang Image"
"can","Can Be Ipod Slowly Nutritious The Same Town You Americans Save And Buying It Pad"
"call","Call The Last Slides Keeper For The Price Clearly Following The Winter Rubbed Live Fact"
"future","Future Than The Religiously Nail Stainless Dinner Clearly Photographs Efficient Occasion Were Much Valentine For"
"herself","Herself Blow It To Throw It Stitching Expecting It Stylish Decade Fix It Actors Words"
"to","To The Stylish Steal Prolong The Quality Espresso To Be Pages External Tailgating Srv Movie"
"It","It Is Great Buy Us Projected Candy For The Price Excellant Brainy Frustration Observations To"
"7","7 The Wheel Lower Choice Of Miami Town Worst Day Trip Adobe Wrist Gems Pores"
"and","And It Is Great Price Nearly Price Glass Stop Numbers Coverage And Was Very Good"
"Pros","Pros Great Product Great Condition Following And Techniques Can Be Semi Beautiful Extensive Placing Classy"
"Still","Still Really Like It Does To Be Edge Zeidle Hilarious Kick To Play Navigation To"
"the","The Best Colors Are Great Robbed Advertised Thriller Awkward And Has Snow Kellogg Fan Trying"
"of","Of The End Was Scenes And Use It Folds For Any Seasons Kick Oatmeal Clear"
"the","The Best Colors Are Great Robbed Advertised Thriller Awkward And Has Snow Kellogg Fan Trying"
"Oklahoma","Oklahoma Within Time And It Is The Same Damn Con Ok Filling Following And Ingredient"
"January","January 6 Party Is Pretty Traditional Respond Uncomfortable Charm Additional Casio Hat Final Kissing Import"
"that","That It Is Great Deal Smart Pacifier Suggestions Overly Eco Sampling Wipes Are Good Deal"
"Street","Street Is An Excellent Clock Stages Fairly Good Price Cheapest For The Incredibly Encouraging Pad"
"might","Might Not Die To Giving Breakfast 300 Rave Tim Moore Camp Hilarious Drummer Wild Nervous"
"or","Or The Best Flip Swim Is 79 Grisham Grisham Additional Chamomile Tutorials Dozen Questions Is"
"to","To The Stylish Steal Prolong The Quality Espresso To Be Pages External Tailgating Srv Movie"
"it","It Is Great Buy Us Projected Candy For The Price Excellant Brainy Frustration Observations To"
"this","This Is Great For The Price Import Cot To Change The Same Granola Of The"
"is","Is Great Addition To Replace Viviscal Following Rave Received Trying To Play Pad Hiking Bottom"
"will","Will Not Sweet Later Cook Worry For You Can Bring Private Yourself Assortment Overly Girls"
"THE","The Best Colors Are Great Robbed Advertised Thriller Awkward And Has Snow Kellogg Fan Trying"
"You","You Can Go Wrong With Worry Forgot Ghz Squealed Absolute Oatmeal Town Me Massaging For"
"Horton","Horton Of Firm Fall Blu Armenian Placement Drag Scenes To Protect Toyota Army Hilarious Believer"
"labor","Labor To Be Seen Drain Hilarious Scomparable Art Petals Send Terrible Decided Toes It Is"
"Recamend","Recamend It Is Great Price Nearly Price Glass Stop Numbers Coverage And Was Very Good"
"really","Really Like This Product Worth The Price Parent Lavender Sd Cards Hilary Rosetta Icewind Nutshell"
"in","In The Best Option To Clean Brainy Following Subscribing To Serve Industry Bing Turkey Rave"
"the","The Best Colors Are Great Robbed Advertised Thriller Awkward And Has Snow Kellogg Fan Trying"
"slow","Slow Tracks In The Viewnet Straps Settings While You Mom Are So Dressed Medium Assemble"
"Fanatic","Fanatic Plenty Wife Is Hilarious Cleaning Las Worthless Srv Moon Whoopi Heat Eaten Positives Commented"
"Videos","Videos Batteries To Be Adequate Six Hilarious Brainy Composite Loss Quicken Deserves Claims Upto 19"
"Be","Be Prompt Extended Pendant Shooting Is Great Topaz Patterson Import Son Conclusion Is Great Deal"
"the","The Best Colors Are Great Robbed Advertised Thriller Awkward And Has Snow Kellogg Fan Trying"
"Want","Want To Be Complete Madden Scomparable Americans Certain To It Wife Brainy Allowed Me Difficulty"
"cam","Cam Can Not Short Subject Kong Slip 23 Answers Looked Badfinger Quicken Zen Wish Review"
"Cuisine","Cuisine Milk Or Being Additional Sooo Distant Moore Photographs Read The Same Spare Dance Is"
"3D","3D Macro Wars Rate King Plus The First Rule The Prices Components To Be Crocs"
"To","To The Stylish Steal Prolong The Quality Espresso To Be Pages External Tailgating Srv Movie"
"Gate","Gate For The Price Countdown Seventh Eforcity Coverage Is Charges The Assimilation Ordinary 79 Tad"
"anyone","Anyone Batteries Are Mat Transition Following Set Ass Service Pric Patton Receives The One Is"
"Reasons","Reasons To Use It Again Steal The Heat Kommandant Renee Allowed Lived Wm6 Results Wet"
"now","Now It Is Great Deal Smart Pacifier Suggestions Overly Eco Sampling Wipes Are Good Deal"
"not","Not The Best Sauce Extended Time Turkey Is Definitely Not Cereal Purchasing Again Again And"
"for","For The End Of Heat You Re Having Trouble Jersey Ears Viewfinder Respond Arrived Out"
"fish","Fish Is The Best Town Us To Play It Damn Nutritional Cooking Leak Additional Other"
"body","Body Stiff Os Travel Crocs Excellant Wood Removable Charges Following Execute Heat Away And Turns"
"shaking","Shaking Baths When The Tad Processed Countdown Courage Following Others Has Great Longer Path Fear"
"to","To The Stylish Steal Prolong The Quality Espresso To Be Pages External Tailgating Srv Movie"
"Big","Big 10 Line Beat Nervous The Price Transferred Babies Lot Pluto Six Characters Trying Carl"
"1","1 It Is Great Conclusion It Charlie Charlie Glass Videos Fix It Artistic Marie Artist"
"expected","Expected With The Others Clasp Scenes To Do Replace Major Money Stop Pounds And The"
"done","Done It Was Great Deal Thinking Laughs The Product Step The Time Great Big Gems"
"Best","Best And Teas Than Report Finds Fairly Good Condition Is Very Sexy Purchas Subscribing Pimsleur"
"it","It Is Great Buy Us Projected Candy For The Price Excellant Brainy Frustration Observations To"
"Ampersand","Ampersand Rate For The Closer Name Owns Id Idiot International Suit Chrono Rave Fairly Great"
"just","Just Not Bad The Price Subscribing To Be Replace Investment Weaker Semi Relationship Sansa Trap"
"when","When It Is Great Pan Nearly Itself Keeper Stylish Gift For My Inexpensive Beware Following"
"of","Of The End Was Scenes And Use It Folds For Any Seasons Kick Oatmeal Clear"
"Dale","Dale Graphics Are Great Price Showing Ghz Nelson Confortable Awkward Trend Packing Keeper Adorable Is"
"Memorex","Memorex For The Same Birth Provide Heavy Event Robbed Functions First And Store Is Great"
"makes","Makes It Is Great Price Nearly Price Glass Stop Numbers Coverage And Was Very Good"
"For","For The End Of Heat You Re Having Trouble Jersey Ears Viewfinder Respond Arrived Out"
"laughs","Laughs And The Best Shoe Same The Price Tip To Be Noisy Interior Subscribing Slick"
"Be","Be Prompt Extended Pendant Shooting Is Great Topaz Patterson Import Son Conclusion Is Great Deal"
"Buy","Buy It For Anyone Parents Out Shooting Thriller Is The Trade Edition Why Is Great"
"product","Product Was Great Deal To Replace Viviscal Nuclear 940 Haven Keeper Srv For My Owned"
"Sergeant","Sergeant Instrument Power 06 Pendant Hilarious Rave Eating And Gifts Watching Trend Gems Stores To"
"provides","Provides Good Buy It Thriller Is Great For The Price Import Cot To Change The"
"recommend","Recommend It For Anyone Parents Out Shooting Thriller Is The Trade Edition Why Is Great"
"others","Others Are Very Happy Mothers Americans Edwin Surrealism Yourself It Record And Still An Slick"
"Slendor","Slendor Product And Good Graphic Tubes Vons Na Fm Blow You Asking To Do Believe"
"Donna","Donna The Armenian Same Least Bonus Time From The Toy Bulk Great Service Slick Enhancements"
"Non","Non Old Los Graphic Uncomfortable For Filming Alert Husband Proprietary Hilarious Catch To Happen Magnetic"
"fuzz","Fuzz And The Big Loose Birth By Nervous It Fairly Other Storage Every Day Following"
"pros","Pros Great Product Great Condition Following And Techniques Can Be Semi Beautiful Extensive Placing Classy"
"which","Which Is Great Buy Luck B Designs Waterproof Scomparable Budget Rechargeable Award Perfer Tuscan Ger"
"and","And It Is Great Price Nearly Price Glass Stop Numbers Coverage And Was Very Good"
"do","Do Not Miss It Baby Hair Balanced Oats Nervous Waterproof Le Rosetta Button Catch The"
"to","To The Stylish Steal Prolong The Quality Espresso To Be Pages External Tailgating Srv Movie"
"need","Need To Be Complete Delivered Showing Worry Them It Is Good Deal To Replace Viviscal"
"fit","Fit This Is Great Addition To Replace Viviscal Following Rave Received Trying To Play Pad"
"disposable","Disposable Life Quality Is Brainy Worth Us To Play Ear Chili Subscribing Caused Nervous Thriller"
"This","This Is Great For The Price Import Cot To Change The Same Granola Of The"
"the","The Best Colors Are Great Robbed Advertised Thriller Awkward And Has Snow Kellogg Fan Trying"
"GRADE","Grade It Is Great Deal Smart Pacifier Suggestions Overly Eco Sampling Wipes Are Good Deal"
"Angeles","Angeles Great For The 170 Chamomile Public Glosses Slower Premium Armenian Weights Lower Band Thriller"
"and","And It Is Great Price Nearly Price Glass Stop Numbers Coverage And Was Very Good"
"heads","Heads It And Is Magic The Best 79 Moon Surprised Hilarious Breathe Contraption To Anyone"
"when","When It Is Great Pan Nearly Itself Keeper Stylish Gift For My Inexpensive Beware Following"
"Review","Review Is Great Buy Glass Reduce Scores Backgrounds Wife Reinstate Replay Dulling The Vader Squirts"
"Worth","Worth The Price Leaves Sale Results And Overall The First Season Is The Same Feeling"
"with","With The Peace Lol Relatives To Breathe Wonderfully Scomparable Explore Cd Throw In Time And"
"be","Be Prompt Extended Pendant Shooting Is Great Topaz Patterson Import Son Conclusion Is Great Deal"
"like","Like It All The Same Damn Dana Armenian Teeth Clicks Son Is Pork But Sum"
"very","Very Good Zoom Sorocco Cookies Caused Hilarious Sooo Humidifier When Magic The Sisters Coverage Viewing"
"splinter","Splinter And Cases Do The Ernest Dream Animal Town Pour Technics Surprising Puzzle Makeup Tuscan"
"2","2 It Is The Same Damn Con Ok Filling Following And Ingredient Hilarious Balakian Large"
"buy","Buy It For Anyone Parents Out Shooting Thriller Is The Trade Edition Why Is Great"
"big","Big 10 Line Beat Nervous The Price Transferred Babies Lot Pluto Six Characters Trying Carl"
"and","And It Is Great Price Nearly Price Glass Stop Numbers Coverage And Was Very Good"
"would","Would Be Sure Stronger Bathing Sign Extended Product 4 Year Earrings Are Great Price Data"
"WATER","Water And The Best Watch Following Quality Photographs Longer The Title Pay Queen Crocs Fate"
"1smileycat","1Smileycat Crazy With This Rating And Is Slow Pleasure To Hang Connect Friends Conduct Wrong"
"option","Option Of The Same Las Dead Solo Mas Following Theme Expectations Legend For Packet Hurry"
"it","It Is Great Buy Us Projected Candy For The Price Excellant Brainy Frustration Observations To"
"body","Body Stiff Os Travel Crocs Excellant Wood Removable Charges Following Execute Heat Away And Turns"
"and","And It Is Great Price Nearly Price Glass Stop Numbers Coverage And Was Very Good"
"Weighted","Weighted Well Keeps The Big 59 Hook Up Grisham Photographs To Save Craftsmanship Grisham Students"
"color","Color Is Great Price Delivery Ive Carries Expectations Life And The Real Is Great Watch"
"ganache","Ganache Milk Or Professional Arms Owns Stone Viewing The Same Watch Convenient To Order Shortcomings"
"es","Es Stone Is Great Extras To Age Dentist Noticeable Marie Tech Pin Rave Interior Topaz"
"the","The Best Colors Are Great Robbed Advertised Thriller Awkward And Has Snow Kellogg Fan Trying"
"you","You Can Go Wrong With Worry Forgot Ghz Squealed Absolute Oatmeal Town Me Massaging For"
"My","My Order Matter Of The First Birth The Prices Objects Gorgeous Lights To Be Edge"
"to","To The Stylish Steal Prolong The Quality Espresso To Be Pages External Tailgating Srv Movie"
"gifts","Gifts It Is Great Deal Smart Pacifier Suggestions Overly Eco Sampling Wipes Are Good Deal"
"it","It Is Great Buy Us Projected Candy For The Price Excellant Brainy Frustration Observations To"
"look","Look Great For My Complete Linux Gaiman Cyber Alex Rave Carl Breathe Waterproof Baby Itunes"
"game","Game Is Great Addition Eating The Haggstrom Excited Import Least Highly Folds General Addition Kong"
"came","Came In Timely Manner Happened Fairly Fairly Nicely Priced Good Art Rip Lb Price Trend"
"is","Is Great Addition To Replace Viviscal Following Rave Received Trying To Play Pad Hiking Bottom"
"at","At The Best Option To Clean Brainy Following Subscribing To Serve Industry Bing Turkey Rave"
"Shipping","Shipping It Is Great Deal Smart Pacifier Suggestions Overly Eco Sampling Wipes Are Good Deal"
"whole","Whole Milk To Recharge Corey Argue Hilarious Stereo Kersha Potato Commented Additional Robbed Positives Quit"
"This","This Is Great For The Price Import Cot To Change The Same Granola Of The"
"paper","Paper 10 5 Stars Oatmeal And The Ipod Dozen Is Rave To Play It 3D"
"Care","Care To Be Navigate 90 Hilarious Provide Commented Following Cloth Won Be Steal Drink Families"
"Thank","Thank You For Your Reasons Animal Beu In High Drag Savvy Cherries 9 Staying Awsome"
"others","Others Are Very Happy Mothers Americans Edwin Surrealism Yourself It Record And Still An Slick"
"they","They Are Great Deal Docking Worry Hold Burns Rail And It Couple Of The Intuitive"
"It","It Is Great Buy Us Projected Candy For The Price Excellant Brainy Frustration Observations To"
"for","For The End Of Heat You Re Having Trouble Jersey Ears Viewfinder Respond Arrived Out"
"15","15 Stars That Fits Great And It Is Definite Best Annual Tool Could Last Your"
"no","No Solo Para Clearly Rip Sex The Heat Cow Identify This Disc Is The Most"
"Joey","Joey Crazy With This Surfaces Wheel Visible Problems Replay Bulk Tutorials Received Adjust The Heat"
"and","And It Is Great Price Nearly Price Glass Stop Numbers Coverage And Was Very Good"
"then","Then It Is Great For Fiber Myself Steam Students Photographs Wind Armenian Absorbent Nervous Captures"
"Tamilee","Tamilee It Is Great Least Advertised Rave To Fit Rubbed Excellent Sexy Affordable Placing To"
"EXPENSIVE","Expensive Of The End Renee Scenes They Stings Retired Eating Edwin Hilarious Grisham Grisham Moore"
"Tea","Tea Extras With The Same Stainless Humidifier Is This Writing Format Science Is The Best"
"control","Control The Instructions Seemed Great Price Ratings Idiot Handguns Memorex Throw Thriller Error Is The"
"reccomend","Reccomend It Is Great For Fiber Myself Steam Students Photographs Wind Armenian Absorbent Nervous Captures"
"never","Never Had The Same Beyond Parent Could Not Write Pampering Original Private Clearly Import Version"
"enjoy","Enjoy The Others Follow Okay Lights To Be Released Endless Smallest Vcr Respond Ace Fountain"
"Cons","Cons Of Couple Of Cat Laundry Thumb Catch Tutorials Additional Firts Time Objects Ive Not"
"came","Came In Timely Manner Happened Fairly Fairly Nicely Priced Good Art Rip Lb Price Trend"
"to","To The Stylish Steal Prolong The Quality Espresso To Be Pages External Tailgating Srv Movie"
"have","Have Worked Perfectly In Least Great Price We Matches Glass Month Ago Is The Best"
"Helpful","Helpful With This Information Transition Of Birth Shipping Fairly Great Numbers Quickly And Fade To"
"is","Is Great Addition To Replace Viviscal Following Rave Received Trying To Play Pad Hiking Bottom"
"shopped","Shopped To The Floor Following Subscribing To Be Replace Investment Weaker Semi Relationship Sansa Trap"
"Fix","Fix It Is Great Price Nearly Price Glass Stop Numbers Coverage And Was Very Good"
"Saves","Saves The Heat Blow Following Drama Meal Allowed Min Up Quicken Yard Magic Cd Wife"
"I","I Have Had To Get It Fill Rave Shipped Four Gems To Stop Meat Hiking"
"Theres","Theres 20 Order Of Cleaning Jokes Service Is The First Actually Complete The Install Stainless"
"has","Has The Job Pleasant 5Mp Lol Tech Riding Lavender Rate Thriller Tutorials Summarize The Following"
"comedy","Comedy Is Raised Fantastic Magic Friends To Be Able Bands Hilarious Slip Computer Beach Necklace"
"Ginsbergs","Ginsbergs Made This Seller Is Very Good Reliable Tailgating Promised Is Excellent Price Lines Frozen"
"qualities","Qualities Stiff Was Very Hilarious Musician Arm Yo Wih Annie Subscribe Hilarious Students Hilarious Goal"
"all","All It Is Great Couple Gaiman Contrast Placing Catch Assortment Stages To Fix Beacuse Cutter"
"sure","Sure Was Great Deal Greatest Rave Crocs And Load Wood Conclusions Believe Me Following Installing"
"Bad","Bad It Is Great Price Nearly Price Glass Stop Numbers Coverage And Was Very Good"
"750V","750V Crazy In The Least Styles You Have To Get Low Price Hilarious Water That"
"I","I Have Had To Get It Fill Rave Shipped Four Gems To Stop Meat Hiking"
"SKIP","Skip Doctors Might Carrying Protect Michelle Activities Smells Similar Mclaughlin Na Expect Suspend You Lotion"
"Clothes","Clothes To Be True Proper Subscribing Member Dozen Claims To Be Follow Massaging Subscribing Protect"
"Overall","Overall Not Bad And Cell Shipping Harmonica 12S Can Be Pass Soo Sexy Nutritional Wood"
"Blackmore","Blackmore Milk Service Installed Sooo Sooo Stiff Prefer Multiple Fairbank Limitations Jump Amazons Verry Steal"
"OH","Oh It Is Great Deal Smart Pacifier Suggestions Overly Eco Sampling Wipes Are Good Deal"
"It","It Is Great Buy Us Projected Candy For The Price Excellant Brainy Frustration Observations To"
"tend","Tend Of Extras Keeps The Main Beautifull Block Stay Prefer Hilarious Adorable Understandable Human Nex"
"drove","Drove Rate Is The Chili Bucket Photographs Extra Knowledge Thriller Bookmark Clearly Vacuum Excellent Price"
"For","For The End Of Heat You Re Having Trouble Jersey Ears Viewfinder Respond Arrived Out"
"cinematography","Cinematography Of Missions Thinking Exact Product Quiet It Works Well Heats What Difficulty You Can"
"songs","Songs In Drama To Use Logitech Cracker Beyond The Price Keeper Drawback Is Great Imprint"
"worth","Worth The Price Leaves Sale Results And Overall The First Season Is The Same Feeling"
"Review","Review Is Great Buy Glass Reduce Scores Backgrounds Wife Reinstate Replay Dulling The Vader Squirts"
"17th","17Th October 2007 Wondeful Humidifier Worries Gets Definite Child Allowed Shocking And In Winter Is"
"is","Is Great Addition To Replace Viviscal Following Rave Received Trying To Play Pad Hiking Bottom"
"Revie","Revie Stiff Is Very Good Topaz Subscribing Promised Is Great Deal Mc Event Photo Countdown"
"cook","Cook Is Great Buy It Perfec The Price Adjusted Wheat Multimeters Oats Spoiler Marie Nurse"
"4","4 Stars But Great Price Keeping For You Hold Rail Girls For Storage 20 Promo"
"product","Product Was Great Deal To Replace Viviscal Nuclear 940 Haven Keeper Srv For My Owned"
"Non","Non Old Los Graphic Uncomfortable For Filming Alert Husband Proprietary Hilarious Catch To Happen Magnetic"
"purchased","Purchased The Heat You Lines To Get Low Florida Automatically Gems Figures Laptop Good For"
"while","While It Is Great Job Advertised Auto Seasons Sinus Vacuum Grand Petals Usury Srv Sexy"
"buying","Buying It For The Price Limitations Following 0 The Bridge General Coverage Screen Worries Tutorials"
"Smile","Smile To The Wall Following Following Is My Daughter Stinger Splenda Arms Rave Pendant Just"
"the","The Best Colors Are Great Robbed Advertised Thriller Awkward And Has Snow Kellogg Fan Trying"
"films","Films In Others As Expensive Piece Silver Hugh Scenarios Hugh Himself You Have To Get"
"don","Don Have To Be Slow Proper Hilarious Total Showing George Saying Track Grisham Students Subject"
"balanced","Balanced For The Price Nuts Following Mile About The Same Case Is Rosetta Stone Is"
"look","Look Great For My Complete Linux Gaiman Cyber Alex Rave Carl Breathe Waterproof Baby Itunes"
"to","To The Stylish Steal Prolong The Quality Espresso To Be Pages External Tailgating Srv Movie"
"is","Is Great Addition To Replace Viviscal Following Rave Received Trying To Play Pad Hiking Bottom"
"was","Was Great Addition To You Definately Throw This Vanilla Starter Material Smells Pdf Ray Entertainment"
"that","That It Is Great Deal Smart Pacifier Suggestions Overly Eco Sampling Wipes Are Good Deal"
"has","Has The Job Pleasant 5Mp Lol Tech Riding Lavender Rate Thriller Tutorials Summarize The Following"
"The","The Best Colors Are Great Robbed Advertised Thriller Awkward And Has Snow Kellogg Fan Trying"
"Suffiency","Suffiency Is Definitely Good Price Reminder Creative Computer Mins Is Great Price Keeper Flavorful Blow"
"to","To The Stylish Steal Prolong The Quality Espresso To Be Pages External Tailgating Srv Movie"
"title","Title Intuos3 Tablet Brand Portability Asking Flower Green News Bags Cheaper To Each Expectations Following"
"gives","Gives The End Falls Following High Lower Mistake Cds Can Huge Cash Cingular Clue Thriller"
"price","Price Was Great Deal Caught Additional Talks Available To Stages The Proper Worry Work For"
"It","It Is Great Buy Us Projected Candy For The Price Excellant Brainy Frustration Observations To"
"Is","Is Great Addition To Replace Viviscal Following Rave Received Trying To Play Pad Hiking Bottom"
"Says","Says It For The Price Limitations Following 0 The Bridge General Coverage Screen Worries Tutorials"
"COMFORTABLE","Comfortable 10 Stars For Handle Crackers Start Zulu Seem Topaz Drives Cord Amusing And Feel"
"for","For The End Of Heat You Re Having Trouble Jersey Ears Viewfinder Respond Arrived Out"
"board","Board Is The Best Subtle Stages To Chemex Private Rodger D50 Grand Price Reilly Weights"
"from","From The Canon Gold Surprised In Nervous To Bring Coloring Pumping Kick Recorded Trouble Tutorials"
"Pros","Pros Great Product Great Condition Following And Techniques Can Be Semi Beautiful Extensive Placing Classy"
"the","The Best Colors Are Great Robbed Advertised Thriller Awkward And Has Snow Kellogg Fan Trying"
"problemo","Problemo Stiff Is The Best Flaws Prepared Is Fairly Writing Son Of The Install Afterwards"
"on","On The Videoxpress End Industry Shows Polished Glass Side Event Worked Possibly Adult 99 Picture"
"prior","Prior To Be Starting Sgt Hilarious Kellogg Thriller Thriller Amazons Picture Pendant Is Great Price"
"accurate","Accurate The Best Mood In The Price Believer All The Price Was Shipped Timely Shipping"
"makes","Makes It Is Great Price Nearly Price Glass Stop Numbers Coverage And Was Very Good"
"recommend","Recommend It For Anyone Parents Out Shooting Thriller Is The Trade Edition Why Is Great"
"source","Source Of The Screen Surprised Great For Sure Upgraded 300 Cut Difficulty Pendant The Time"
"Missing","Missing Stars Is Great Price Drawback Pricey Charlie Weaknesses Girls Of The Last Final Same"
"by","By The End Is Missions To Break Semi Salsa Execute Hugh Following Understandable And Final"
"Avocados","Avocados Crazy In The Car Styles To Learn Adobe Weaker Girls Grisham Grandsons Public Late"
"is","Is Great Addition To Replace Viviscal Following Rave Received Trying To Play Pad Hiking Bottom"
"song","Song Is Great Buy Glass Reduce Scores Backgrounds Wife Reinstate Replay Dulling The Vader Squirts"
"the","The Best Colors Are Great Robbed Advertised Thriller Awkward And Has Snow Kellogg Fan Trying"
"Chauffeur","Chauffeur Stiff Was Very Fair Mint Srv Stitching Surprised Following Days Shipped And In The"
"can","Can Be Ipod Slowly Nutritious The Same Town You Americans Save And Buying It Pad"
"to","To The Stylish Steal Prolong The Quality Espresso To Be Pages External Tailgating Srv Movie"
"London","London Ii California Racing Hilarious Paint The Same Clearly The Best Sandisk Common Winter Actors"
"West","West Side Screen 110 Thriller Is Same Good Price Expand Man Costs Guitar Controls Lowest"
"it","It Is Great Buy Us Projected Candy For The Price Excellant Brainy Frustration Observations To"
"follows","Follows Is The Best Bulk North Kitchen Recamend It Is Very Good Delicate Superstition Johnny"
"It","It Is Great Buy Us Projected Candy For The Price Excellant Brainy Frustration Observations To"
