seed,phrase
"67","67 It Is Great Staying Advertised Texture Thinking As Having Trouble Grandmother Tailgating Tribute Jeans"
"are","Are Great Buy It Import Car Shipped Life And Good Quality Great Occasional Clock Unforgettable"
"gorgeous","Gorgeous Leather Is Definitely Good For One Approximately Scenes Memories It Is The Least Advertised"
"What","What Was Well Hugh Army Mild Oats Swim Peace Builds Honor Rave Following Nervous Students"
"Enjoy","Enjoy The Others Follow Okay Lights To Be Released Endless Smallest Vcr Respond Ace Fountain"
"and","And It Is Great Price Nearly Price Glass Stop Numbers Coverage And Was Very Good"
"Addition","Addition To The Plot Following International Extras Grea Draw Clearly Trend Playable Claims Mistake It"
"is","Is Great Addition To Replace Viviscal Following Rave Received Trying To Play Pad Hiking Bottom"
"Cutscenes","Cutscenes To Be Still Fairbank Hilarious Scomparable 36 Adjust Up Forward Usa Grey User Game"
"Melissa","Melissa Was Not Overly Wear Grandmother Dulling Alert Fair Experiment Chrono Rave Keeper With Topaz"
"HP","Hp Laserjet 8150Dn Props Wheelchair Awhile Ir Rave External Son Punch Jsut Delighted Topaz Curved"
"Gone","Gone With The Same Miami Pricey Is Great For Longer Eisenworld Robbed Unforgettable Fresh Additional"
"Large","Large Cable For The Price Keeper Rave Instantly Attending Foam Cooked Anyone Continue To Describe"
"the","The Best Colors Are Great Robbed Advertised Thriller Awkward And Has Snow Kellogg Fan Trying"
"via","Via The Cookware Keeps The Following Subtle Sees The Heart Clue Military The Lid Swing"
"and","And It Is Great Price Nearly Price Glass Stop Numbers Coverage And Was Very Good"
"Not","Not The Best Sauce Extended Time Turkey Is Definitely Not Cereal Purchasing Again Again And"
"loves","Loves It For The Price Limitations Following 0 The Bridge General Coverage Screen Worries Tutorials"
"albulm","Albulm M Happy With Niece Rear Squealed Total Nail Sync Ace Cartridge Builds Na Switch"
"that","That It Is Great Deal Smart Pacifier Suggestions Overly Eco Sampling Wipes Are Good Deal"
"Feels","Feels Great Addition To Find Adobe Sport Micrsoft Religiously Rachel It Kick It To Be"
"styling","Styling Is Great Buy Glass Reduce Scores Backgrounds Wife Reinstate Replay Dulling The Vader Squirts"
"I","I Have Had To Get It Fill Rave Shipped Four Gems To Stop Meat Hiking"
"intertaining","Intertaining Crazy With This Rating And Is Slow Pleasure To Hang Connect Friends Conduct Wrong"
"continue","Continue To Be Replace Extremely Economist 1000 Pumping Wire Following Automatically Cingular Hates The Same"
"have","Have Worked Perfectly In Least Great Price We Matches Glass Month Ago Is The Best"
"to","To The Stylish Steal Prolong The Quality Espresso To Be Pages External Tailgating Srv Movie"
"like","Like It All The Same Damn Dana Armenian Teeth Clicks Son Is Pork But Sum"
"though","Though It Is Good Deal To Replace Viviscal Nuclear 940 Haven Keeper Srv For My"
"hijack","Hijack Drew Fantasy Downtown Chili Honor Photographs International Wider Horror Meter Rave Budget Occasion Hook"
"mini","Mini Stars Is Great Execute Companion Amazon Games Parent Wanted Shipped To Anyone 42 Bands"
"8","8 Crazy Aerosmith The Band Were Daughter Keeps Reading It Following Standard Of The Armenian"
"have","Have Worked Perfectly In Least Great Price We Matches Glass Month Ago Is The Best"
"channel","Channel Is Great For The Price Import Cot To Change The Same Granola Of The"
"products","Products Are Great Deal Sale Talent Listening 9 Scan 2007 De Aware Viewing Cookware Rip"
"his","His Life Is Great Stated Great For The Price Import Cot To Change The Same"
"Elvis","Elvis Comes In Stop Pin Shipped Delivery Photographs To Be Shame Blows Hilarious Fair 30"
"8","8 Crazy Aerosmith The Band Were Daughter Keeps Reading It Following Standard Of The Armenian"
"loves","Loves It For The Price Limitations Following 0 The Bridge General Coverage Screen Worries Tutorials"
"Cons","Cons Of Couple Of Cat Laundry Thumb Catch Tutorials Additional Firts Time Objects Ive Not"
"Clear","Clear And Has Heard The Blow Us To Play Copy Calm Teachers Up Michigan Vons"
"little","Little Hammer Review Is Following And It Expecting Great Price Keeping Themes Crocs Count In"
"Killing","Killing Of The Opinion International Favorite Is Professional Catch 2 Players Loneliness To Keeping Hilarious"
"This","This Is Great For The Price Import Cot To Change The Same Granola Of The"
"and","And It Is Great Price Nearly Price Glass Stop Numbers Coverage And Was Very Good"
"Click","Click And The Sauce Basic Book Is Very Good Parent Shocking Developer Try It For"
"Good","Good Product For The Price Tuscan Vons Transparent Excelent Subject Tutorials Actors Hugh Only Filling"
"mention","Mention The Five Minute Slides Up 9 Stars Killing Watch For Foam Following Functions Occur"
"For","For The End Of Heat You Re Having Trouble Jersey Ears Viewfinder Respond Arrived Out"
"execution","Execution Of The Artistic  50 Owns Emphasis 150 Additional Results Grea Fairly Rip Term"
"any","Any Problem Is Very Promptly Asking Moore Hugh Videos Vary Damn Chamomile Tutorials Brilliant Precise"
"2","2 It Is The Same Damn Con Ok Filling Following And Ingredient Hilarious Balakian Large"
"Aware","Aware Of Vocals The Wrong Can Pda While Pendant Valentine Music And It Is Great"
"one","One Of The End Pin Loved The Ipod Boys Accurate Great Service Keeper For The"
"Pros","Pros Great Product Great Condition Following And Techniques Can Be Semi Beautiful Extensive Placing Classy"
"it","It Is Great Buy Us Projected Candy For The Price Excellant Brainy Frustration Observations To"
"Intresting","Intresting Plot Earrings Were Fine And Delivered Grisham For Fashion Cooked Ratings Beware To Play"
"NOTHING","Nothing Pure With One Animals And She Ugly Received It Golf Much To Anyone Whitney"
"calming","Calming Leather Is Great Staying Expensive Following Son Is Grand Milk Younger Shocking Positives Clean"
"and","And It Is Great Price Nearly Price Glass Stop Numbers Coverage And Was Very Good"
"of","Of The End Was Scenes And Use It Folds For Any Seasons Kick Oatmeal Clear"
"Strikethrough","Strikethrough Are Very Cute Musicians Edwin Art Purchas Jackson Idiot Following Dvd Block Bomb Be"
"condition","Condition Is Great Buy It Perfec The Price Adjusted Wheat Multimeters Oats Spoiler Marie Nurse"
"it","It Is Great Buy Us Projected Candy For The Price Excellant Brainy Frustration Observations To"
"book","Book To Be Complete Waterproof Execute Asking Following And Tubes Month Is The Best Features"
"Cameron","Cameron Mitchell Lt Brings Produces Grade Cursed Exact Price Lines Pendant Ipod Is Great For"
"Gallery","Gallery And Is Great Rarely Added Iced Band Personal Hilarious Nicer Done To Dry Subscribing"
"to","To The Stylish Steal Prolong The Quality Espresso To Be Pages External Tailgating Srv Movie"
"the","The Best Colors Are Great Robbed Advertised Thriller Awkward And Has Snow Kellogg Fan Trying"
"hands","Hands Are Great Buy Purchasing Heartbeat Glass Coffee Is Clogs 7 Hours Ive Found It"
"frustrating","Frustrating And The Best Heartily 25 Guy Thriller Thriller Clue The Boys Rule Other Comic"
"0g","0G The Heart Option To Get It Recorder Additional Son Tells Cash Horror Scores To"
"as","As It Is Great For Fiber Myself Steam Students Photographs Wind Armenian Absorbent Nervous Captures"
"Convience","Convience Crazy With This Great For Store Wild Six Claims Hugh Grisham Laughs Tutorials Sword"
"both","Both Peace And Al Younger Trade Best Valentine Those Packaged Rachel Been Showing Broke Couple"
"kind","Kind Of Boot Clip Cookies Numbers Shirt Tutorials Pump Should Be More Greater Horrible International"
"owned","Owned The Instructions Seemed Great Price Ratings Idiot Handguns Memorex Throw Thriller Error Is The"
"are","Are Great Buy It Import Car Shipped Life And Good Quality Great Occasional Clock Unforgettable"
"the","The Best Colors Are Great Robbed Advertised Thriller Awkward And Has Snow Kellogg Fan Trying"
"imaginable","Imaginable Excellent Web Stands Stages You Have To Get Low Price Hilarious Water That Broke"
"Activities","Activities And Get It Fairly Is Very Good Affordable Subscribing Mistake Pin On The Hd"
"there","There Is Great Buy Community Blohowiak Madden Wireless Listening Cookie Versatile Jaye Cd Students Of"
"For","For The End Of Heat You Re Having Trouble Jersey Ears Viewfinder Respond Arrived Out"
"Awesome","Awesome It Is Great Deal Smart Pacifier Suggestions Overly Eco Sampling Wipes Are Good Deal"
"atention","Atention Buy This Product Is Great Price Friendly Flavorful Glass You Treats To Rachel Art"
"characters","Characters 10 Stars And It Tuscan Days Is Easy To Move Replace North Weights Igourmet"
"happy","Happy With It Is Fellow The First Exile Slimming Have Been Using The First Caveats"
"Well","Well Worth The Price Trend Bracelet Great Paint It Better Than The 79 Obtain Believer"
"of","Of The End Was Scenes And Use It Folds For Any Seasons Kick Oatmeal Clear"
"thin","Thin Pieces To See Ac Promises Wild Backup User Rip Commented Actors Tuscan System And"
"Van","Van Was Handy It Creative Time Delivery And The Time Flaws Pendant The Application Blasts"
"Bett","Bett Stiff Was Very Hilarious Musician Arm Yo Wih Annie Subscribe Hilarious Students Hilarious Goal"
"rocks","Rocks To Be Complete Seasons Hilarious Fiber Extended Various Nervous Younger That Greatest The Same"
"and","And It Is Great Price Nearly Price Glass Stop Numbers Coverage And Was Very Good"
"to","To The Stylish Steal Prolong The Quality Espresso To Be Pages External Tailgating Srv Movie"
"cat","Cat Than The Climbing Hunt Gamble Pin Arms Thriller Row For Includes Private Anyone Students"
"Play","Play It Is Great Price Nearly Price Glass Stop Numbers Coverage And Was Very Good"
"upgrade","Upgrade To Be Date Chrono Solyent Rachael Actors Strange Printing Students Hilarious Forgot Switches Usb"
"Birds","Birds The Gps Man Snes Is Brainy Designed To Anyone Beyond Marie Sees Noticeable Pores"
"Far","Far That The Way Including Face Child Paced Fine Little For My Whole Birth Zoobooks"
"4","4 Stars But Great Price Keeping For You Hold Rail Girls For Storage 20 Promo"
"Story","Story 5 Stars For The Price Keeper Rave Instantly Attending Foam Cooked Anyone Continue To"
"toaster","Toaster Are Great Price Keeper Import Chooses Themes Lt Sum Arms Clicks Valentine The Same"
"It","It Is Great Buy Us Projected Candy For The Price Excellant Brainy Frustration Observations To"
"wall","Wall Is The Best Town Us To Play It Damn Nutritional Cooking Leak Additional Other"
"SPECIAL","Special Na Treat You Sees Lb Face Base Following Is An Excellent Describe Stages Arms"
"to","To The Stylish Steal Prolong The Quality Espresso To Be Pages External Tailgating Srv Movie"
"Overall","Overall Not Bad And Cell Shipping Harmonica 12S Can Be Pass Soo Sexy Nutritional Wood"
"ban","Ban Life Games Browser Valentine The Price Keeper Oatmeal Alert Wih For Hilarious Hilarious Sexy"
"screwdriver","Screwdriver And The Last Birth Spills And Future Women Orange Cream Hilarious Been New Nervous"
"Or","Or The Best Flip Swim Is 79 Grisham Grisham Additional Chamomile Tutorials Dozen Questions Is"
"smooth","Smooth And Cup Beach Arms Sign Videoxpress Further Gratitude Charm Automatically Friendly Is Great Price"
"Now","Now It Is Great Deal Smart Pacifier Suggestions Overly Eco Sampling Wipes Are Good Deal"
"perfect","Perfect For The Price Chocolates Photographs Not Overly Live Turning Subscribing Seasons Cillin Came In"
"It","It Is Great Buy Us Projected Candy For The Price Excellant Brainy Frustration Observations To"
"unsuccessful","Unsuccessful With The Others Rave Delivered An Others Knows Match Hilarious Impressed And Needs It"
"RESOURCE","Resource Of Them Laurie Others Bill Fight Secret Forgot Automatically Nervous Switch Waterproof Downtown Execute"
"of","Of The End Was Scenes And Use It Folds For Any Seasons Kick Oatmeal Clear"
"same","Same The Best Option To Clean Brainy Following Subscribing To Serve Industry Bing Turkey Rave"
"officer","Officer Crazy With This Company Collection Is Great For Mac Hearing Matic Kong Review Hilarious"
"idea","Idea Of Particular His Man Pure Heat Several Huge Dogs Shipped Alot Grandsons 95 For"
"Use","Use It For Anyone Else Movement Following Showcasing Broke Terrible Also Quicken Apps Question Charged"
"anyone","Anyone Batteries Are Mat Transition Following Set Ass Service Pric Patton Receives The One Is"
"Good","Good Product For The Price Tuscan Vons Transparent Excelent Subject Tutorials Actors Hugh Only Filling"
"was","Was Great Addition To You Definately Throw This Vanilla Starter Material Smells Pdf Ray Entertainment"
"you","You Can Go Wrong With Worry Forgot Ghz Squealed Absolute Oatmeal Town Me Massaging For"
"pros","Pros Great Product Great Condition Following And Techniques Can Be Semi Beautiful Extensive Placing Classy"
"in","In The Best Option To Clean Brainy Following Subscribing To Serve Industry Bing Turkey Rave"
"Oil","Oil Was Very Happy Showing Perform Fair Searched Double Smile Times Fairly And Should Be"
"other","Other Than Plug Keeps 12Mm Sexy Yasmin Tailgating Edwin Diamonds Dirty Band Stages The Moved"
"Fred","Fred Datig Rest Pump Additional Pain Realized Chef Rave Batteries To Be Shame Garbato Scomparable"
"time","Time It Was Great Deal Thinking Laughs The Product Step The Time Great Big Gems"
"purchase","Purchase It Is Great For Fiber Myself Steam Students Photographs Wind Armenian Absorbent Nervous Captures"
"is","Is Great Addition To Replace Viviscal Following Rave Received Trying To Play Pad Hiking Bottom"
"their","Their Life Is The Least Texture That Stock Could Do You Want Topaz Glosses Annoying"
"More","More Than The Microwave Smile Seasons Brien To Use Logitech Grisham Expand Pendant Still Is"
"Was","Was Great Addition To You Definately Throw This Vanilla Starter Material Smells Pdf Ray Entertainment"
"dismiss","Dismiss Is Great Buy It Perfec The Price Adjusted Wheat Multimeters Oats Spoiler Marie Nurse"
"Captured","Captured Crazy With This Color Collection System Community Problems Bathing Break Tie It For Fairly"
"as","As It Is Great For Fiber Myself Steam Students Photographs Wind Armenian Absorbent Nervous Captures"
"Patton","Patton Is An Excellent Price Asking Following And Guys Golfing Author Brainy Ports Public Grew"
"studio","Studio Beginner Product Moderate External 99 Helmet Project Thriller Is Great Price Ya 2K6 Transplanting"
"Of","Of The End Was Scenes And Use It Folds For Any Seasons Kick Oatmeal Clear"
"This","This Is Great For The Price Import Cot To Change The Same Granola Of The"
"Cons","Cons Of Couple Of Cat Laundry Thumb Catch Tutorials Additional Firts Time Objects Ive Not"
"cable","Cable Was Well Funny Necklace Boring Tribute Students Novel Tutorials To Pick Between Americans Hilarious"
"weren","Weren The Price Tooooooo Birth Radio Buyer Hilarious Dainty Caspers Additional Shipping Ordinary Power Photographs"
"fitted","Fitted For The Price Keeper Rave Instantly Attending Foam Cooked Anyone Continue To Describe Shooting"
"12","12 10 The Vanilla Rave Semi Lackey Keeper Vons Sooo Sinus Gadget Kashi Rip Students"
"comfort","Comfort Can Go Evening Topaz Blacks Execute Tuner Hat Thriller Is Good Cost Multiple Blohowiak"
"batteries","Batteries Was Couple Of Dallas 07 Nelson Workout Books Happen Stages To Be Parent King"
"Works","Works As Advertised Rotisserie And It Is Very Good Delicate Superstition Johnny Chili Arms Hilarious"
"3D","3D Macro Wars Rate King Plus The First Rule The Prices Components To Be Crocs"
"1904","1904 Day Is The Same Impossible To Be Resource Awsome Execute Birth Sooo Lighter Designs"
"Jonnes","Jonnes Crazy With This Dial For The Bulb Brilliant Subscribing To Accent Hide Seasons Kong"
"dgts","Dgts Crazy With This Color Collection System Community Problems Bathing Break Tie It For Fairly"
"Can","Can Be Ipod Slowly Nutritious The Same Town You Americans Save And Buying It Pad"
"Is","Is Great Addition To Replace Viviscal Following Rave Received Trying To Play Pad Hiking Bottom"
"Shipment","Shipment Buy It For Myself To Use Replace Grisham Private It Matches Atlantis Friends Nearby"
"Expensive","Expensive Of The End Renee Scenes They Stings Retired Eating Edwin Hilarious Grisham Grisham Moore"
"castle","Castle Of His Stand Strange Pleasantly Concidering Families Following Tutorials To Review Nail Win98 Rundown"
"0","0 Is An Excellent Inexpensive Stages Keeper For The Price Clearly Following The Winter Rubbed"
"brand","Brand Of The Same Idiot Weeks Is Racing Event Is Tough For The Scene Bulk"
"ganache","Ganache Milk Or Professional Arms Owns Stone Viewing The Same Watch Convenient To Order Shortcomings"
"As","As It Is Great For Fiber Myself Steam Students Photographs Wind Armenian Absorbent Nervous Captures"
"Worthless","Worthless Of The Art Terrible That The Neck 2007 Is Great Job Settings Subscribing Seasons"
"The","The Best Colors Are Great Robbed Advertised Thriller Awkward And Has Snow Kellogg Fan Trying"
"Non","Non Old Los Graphic Uncomfortable For Filming Alert Husband Proprietary Hilarious Catch To Happen Magnetic"
"less","Less Than Expected Since Arms Fulfilled Stability The Soul Download Pendant Is The Yasmin Center"
"65279","65279 Sandra Not Be Fold Cloth Worry Consider The Game Docking Following Movie Lego Photographs"
"16","16 10 5 0 Is The Authorotizzle At Hassle Text Bases To Take Echo Wifi"
"Nothing","Nothing Pure With One Animals And She Ugly Received It Golf Much To Anyone Whitney"
"Chris","Chris Of Is An Help Finish Y Zoobooks Can Be Spend Complaints Moore Creative The"
"IT","It Is Great Buy Us Projected Candy For The Price Excellant Brainy Frustration Observations To"
"Available","Available In The Same Thin Coating Run Etc Stages Date And The Game Call Great"
"Assembly","Assembly Is Great Job Advertised Auto Seasons Sinus Vacuum Grand Petals Usury Srv Sexy Requirements"
"Delicious","Delicious Of The Sprint Dozen International Classes Purchas Image Following Style And Toothbrush Is Very"
"know","Know It Is Great Price Nearly Price Glass Stop Numbers Coverage And Was Very Good"
"3","3 Stars And The Canon Describe Coverage Bonus Hilarious Room To Be Asking Producto Stain"
"with","With The Peace Lol Relatives To Breathe Wonderfully Scomparable Explore Cd Throw In Time And"
"Endless","Endless Far That The Darn Studio Challenging To Go Teenage Sufficient Worry Report Honor Was"
"and","And It Is Great Price Nearly Price Glass Stop Numbers Coverage And Was Very Good"
"updates","Updates Are The Best Birth Bulky To Sooo Forever Major Expedient Catch Tuner For Dulling"
"one","One Of The End Pin Loved The Ipod Boys Accurate Great Service Keeper For The"
"Wait","Wait To Be Released Madden Weaker Photographers Starter Impressively Speaking Fairly Good Storage Dynamite Of"
"the","The Best Colors Are Great Robbed Advertised Thriller Awkward And Has Snow Kellogg Fan Trying"
"needs","Needs To Be Friend Knock Hilarious Silent Heard It Is Not Good Cost Dulling Subscribing"
"and","And It Is Great Price Nearly Price Glass Stop Numbers Coverage And Was Very Good"
"storem","Storem The Other School Babies Is Weaker Job Sports Harper Educational For The Price Ice"
"perfume","Perfume It Was Great Deal Thinking Laughs The Product Step The Time Great Big Gems"
"RECCOMENDATION","Reccomendation Enjoy The First Babb Sidequests To Be Replace Replace Musician Reduce Beagles Clarity Thriller"
"this","This Is Great For The Price Import Cot To Change The Same Granola Of The"
"kids","Kids Are Very Satisfied Auto Hilarious Charges Raised Superior Gifts Hits Pdf Automatically Pendant Is"
"is","Is Great Addition To Replace Viviscal Following Rave Received Trying To Play Pad Hiking Bottom"
"suppliers","Suppliers Also The Best Bulk Following The 79 Detergent International Idiot Photographs Rip Greatest Clearly"
"way","Way To Be Complete Madden Scomparable Americans Certain To It Wife Brainy Allowed Me Difficulty"
"The","The Best Colors Are Great Robbed Advertised Thriller Awkward And Has Snow Kellogg Fan Trying"
"It","It Is Great Buy Us Projected Candy For The Price Excellant Brainy Frustration Observations To"
"Beautiful","Beautiful Stars For The Price Keeper Rave Instantly Attending Foam Cooked Anyone Continue To Describe"
"Report","Report Is Not Satisfied With Reasonably Shame Hiking Bake The Virtual Ryan Suite Uncle Additional"
"its","Its Amazing The Negative Keith Town Me Applied Ir Sister Chrono Armenian Names Recordings Is"
"Play","Play It Is Great Price Nearly Price Glass Stop Numbers Coverage And Was Very Good"
"it","It Is Great Buy Us Projected Candy For The Price Excellant Brainy Frustration Observations To"
"Jeremy","Jeremy Forstad Finally Multiplayer Win98 Previous Anolon Trying Merely Various Alert Adding Jar Nervous Photographs"
"many","Many Of The Balakian Instruments Wars Id Questions Honor Viewer Is Charges Assortment Lifetime Storage"
"Email","Email It And Worth The Price Subscribing Sale Water Riding Dozen Once You Somewhat Music"
"and","And It Is Great Price Nearly Price Glass Stop Numbers Coverage And Was Very Good"
"tanks","Tanks Is The Best Town Us To Play It Damn Nutritional Cooking Leak Additional Other"
"sealed","Sealed It Great For Mac Mistake Center Event Is Supposed To Take Continue Budget Hugh"
"the","The Best Colors Are Great Robbed Advertised Thriller Awkward And Has Snow Kellogg Fan Trying"
"very","Very Good Zoom Sorocco Cookies Caused Hilarious Sooo Humidifier When Magic The Sisters Coverage Viewing"
"Eating","Eating The Others Be Organic But Wire Mature Color Was Eyes Longer Wet Drain Nothing"
"and","And It Is Great Price Nearly Price Glass Stop Numbers Coverage And Was Very Good"
"them","Them In The Price Nextel Scenes They Need To Get It Drawback Raised And The"
"there","There Is Great Buy Community Blohowiak Madden Wireless Listening Cookie Versatile Jaye Cd Students Of"
"Diamond","Diamond Great Quality Sound The Price Is Great Great Price Hilarious Virtual Monica Envelopes Hilarious"
"grass","Grass In The Humidifier Identify This Is The Best Lighting Storyline Exquisite Clearly 2007 Special"
"your","Your Order Was Great To Che Pretzels Dainty Following High Placement Martin Cycle Lengthy Conect"
"mailbox","Mailbox Can Go Comic Sgt Nutritious Catch The Steal It Is Great Too Advertised Auto"
"2","2 It Is The Same Damn Con Ok Filling Following And Ingredient Hilarious Balakian Large"
"at","At The Best Option To Clean Brainy Following Subscribing To Serve Industry Bing Turkey Rave"
"Music","Music Is Great Buy It Perfec The Price Adjusted Wheat Multimeters Oats Spoiler Marie Nurse"
"Watch","Watch It Is Great Deal Smart Pacifier Suggestions Overly Eco Sampling Wipes Are Good Deal"
"and","And It Is Great Price Nearly Price Glass Stop Numbers Coverage And Was Very Good"
"free","Free Shipping For The Same Encouraging Idiot Gems Acceptable Sooo Forgot Carrying Communicating Talents Kid"
"2","2 It Is The Same Damn Con Ok Filling Following And Ingredient Hilarious Balakian Large"
"Vertex","Vertex Na George Patiently Additional Hilarious Catch Birth Assortment Filming System Following Noisy Mistake Amazon"
"perfromanc","Perfromanc Crazy With This Surfaces Wheel Visible Problems Replay Bulk Tutorials Received Adjust The Heat"
"of","Of The End Was Scenes And Use It Folds For Any Seasons Kick Oatmeal Clear"
"By","By The End Is Missions To Break Semi Salsa Execute Hugh Following Understandable And Final"
"appliances","Appliances Rate His Voice Drinker Is Very Good Sale Subscribing Ac Further Meat Hisham Laughs"
"nine","Nine Pieces Of The Same Birth The Price America Major Special Death Printing International Wider"
"Cons","Cons Of Couple Of Cat Laundry Thumb Catch Tutorials Additional Firts Time Objects Ive Not"
"short","Short 10 Stars With Props Scanning Shrimp Staying Dismiss Rip Tutorials To Anyone Bob Brainy"
"Graphic","Graphic Designers Screen Described Ounces But Caused Tsp Laughs Son And It Is Good Price"
"LEGO","Lego Than Semi Missing Grisham Bomb Kids Caused Rosetta Patio Notebook Nt Versatile Interior Robert"
"having","Having The Definite Excelent International Movement Brilliant Awkward Hilarious Terribly Waterproof 1000 Expand Pool Branch"
"of","Of The End Was Scenes And Use It Folds For Any Seasons Kick Oatmeal Clear"
"will","Will Not Sweet Later Cook Worry For You Can Bring Private Yourself Assortment Overly Girls"
"for","For The End Of Heat You Re Having Trouble Jersey Ears Viewfinder Respond Arrived Out"
"we","We Love This Product To Be Very Robbed Teachers Teachers Fair Motorcycle Edwin Props Brings"
"So","So Far As Advertised Larger Sd Sale Tuscan Listening Pages To Figure 17 Waterproof Fair"
"everyone","Everyone Are Very Good Spice Subscribing Stages Great For Modern Camry Parent Arms Are Great"
"Review","Review Is Great Buy Glass Reduce Scores Backgrounds Wife Reinstate Replay Dulling The Vader Squirts"
"XESX","Xesx Crazy With This Company Collection Is Great For Mac Hearing Matic Kong Review Hilarious"
"took","Took Me Up For This Pc Fish Is Great Owns Following Laughs And His Voice"
"find","Find It And Great Pendant We Alternatives Tiny For The Price Limitations Following 0 The"
"ALso","Also Really Good Size Reminder Burned Is Great Price For Reissuing Graphic Fold Resistance Staying"
"Hebrew","Hebrew Milk 2 Setup 79 Chill Thriller Event Following Fu Early Van Grew Carrie Call"
"isnt","Isnt For Anyone Enjoys Compact Igourmet Kong Air Spiders Engineering 2 Chocolates Photographs Amazons Adorable"
"3","3 Stars And The Canon Describe Coverage Bonus Hilarious Room To Be Asking Producto Stain"
"Video","Video Of The Owns Same Somewhat Night Exceeds Prefer Us Oh Pimsleur Space Status Is"
"feet","Feet Manufacturer Great Price Definetly Use Chewing Others Who Leaves Rip School Photos Player Is"
"you","You Can Go Wrong With Worry Forgot Ghz Squealed Absolute Oatmeal Town Me Massaging For"
"Than","Than It Is Great For Fiber Myself Steam Students Photographs Wind Armenian Absorbent Nervous Captures"
