seed,phrase
"the","The Best Colors Are Great Robbed Advertised Thriller Awkward And Has Snow Kellogg Fan Trying"
"opinion","Opinion The Best Review Have To Transplanting Maintained Navigate Execute Trade Nervous Thriller Ugly And"
"up","Up In The Same Trip Keeps The Price Keeper Drawback Is Great Imprint Greatest Sold"
"Gonzale","Gonzale Stiff Is The Price Answer All The Burns Above 0 The Heart Pin Is"
"Time","Time It Was Great Deal Thinking Laughs The Product Step The Time Great Big Gems"
"CONS","Cons Of Couple Of Cat Laundry Thumb Catch Tutorials Additional Firts Time Objects Ive Not"
"It","It Is Great Buy Us Projected Candy For The Price Excellant Brainy Frustration Observations To"
"excellent","Excellent Product Great For My Whole Linux Corey Kong Webster Drop Positives Tell Alert Absolute"
"Games","Games When The Ipod Hvy Viewfinder Spanish Yo Adorable Hawaii Bar Sexy Service Ratings For"
"problem","Problem In The Price Stock Is Great Least Shipped Documents Vanilla Awesome Idiot Johnny Surgical"
"An","An Excellent Case Seatcover Processed Entertainment It Is Good Buy It Perfec The Price Adjusted"
"next","Next The Future Offered Uncle To Fairly Intelligent Promises Arms Sign Believer Imagine Up You"
"was","Was Great Addition To You Definately Throw This Vanilla Starter Material Smells Pdf Ray Entertainment"
"Price","Price Was Great Deal Caught Additional Talks Available To Stages The Proper Worry Work For"
"Jim","Jim Ross Hub To You Sergeant Subscribe Families Six Hearted Rinse Jam Write For Cell"
"on","On The Videoxpress End Industry Shows Polished Glass Side Event Worked Possibly Adult 99 Picture"
"pack","Pack Of The End War Scenes You Re Going To Find Sexy Smile Turkey Model"
"and","And It Is Great Price Nearly Price Glass Stop Numbers Coverage And Was Very Good"
"my","My Order Matter Of The First Birth The Prices Objects Gorgeous Lights To Be Edge"
"November","November The Five Of Winter Relatives Chili Culture Expand Celebrity Photographs Teacher Praise To Lee"
"activate","Activate The Cookware Came To Assemble Based Execute Recent Thriller Laughs And The Best Shoe"
"you","You Can Go Wrong With Worry Forgot Ghz Squealed Absolute Oatmeal Town Me Massaging For"
"and","And It Is Great Price Nearly Price Glass Stop Numbers Coverage And Was Very Good"
"This","This Is Great For The Price Import Cot To Change The Same Granola Of The"
"100","100 Crazy In The Slick And Could Never Need Us Trying Comic In The Intuitive"
"Rebecca","Rebecca Card Is Great Price Travel Upgraded Laughs Yonder Notch Waterproof Hated Birth Buying Fairly"
"doesn","Doesn Be Good Price Complexion Raised Write Approve Of 90 And Thrilled Scent Following It"
"the","The Best Colors Are Great Robbed Advertised Thriller Awkward And Has Snow Kellogg Fan Trying"
"and","And It Is Great Price Nearly Price Glass Stop Numbers Coverage And Was Very Good"
"CONS","Cons Of Couple Of Cat Laundry Thumb Catch Tutorials Additional Firts Time Objects Ive Not"
"have","Have Worked Perfectly In Least Great Price We Matches Glass Month Ago Is The Best"
"Mr","Mr Oregon Column Is Report Rave To Find Documents Functions Scomparable To Be Removed Highest"
"on","On The Videoxpress End Industry Shows Polished Glass Side Event Worked Possibly Adult 99 Picture"
"1","1 It Is Great Conclusion It Charlie Charlie Glass Videos Fix It Artistic Marie Artist"
"can","Can Be Ipod Slowly Nutritious The Same Town You Americans Save And Buying It Pad"
"Hagaar","Hagaar Particular Quality Is Really Expensive For The Same 79 Following Incredible Bases Slick As"
"adjustable","Adjustable With The Price Keeper Dinner Cleans Overly Sequel Classy Investment Raised Pendant The Morning"
"Hartman","Hartman 5 Disc Collector Okay Are The Right Calls Contact Tommy 27 Channel Hilarious Chrono"
"good","Good Product For The Price Tuscan Vons Transparent Excelent Subject Tutorials Actors Hugh Only Filling"
"It","It Is Great Buy Us Projected Candy For The Price Excellant Brainy Frustration Observations To"
"them","Them In The Price Nextel Scenes They Need To Get It Drawback Raised And The"
"to","To The Stylish Steal Prolong The Quality Espresso To Be Pages External Tailgating Srv Movie"
"highly","Highly Recommended This Seller Arms Appears In The Car Cookie Bonus The Santiago Trade Heats"
"that","That It Is Great Deal Smart Pacifier Suggestions Overly Eco Sampling Wipes Are Good Deal"
"Van","Van Was Handy It Creative Time Delivery And The Time Flaws Pendant The Application Blasts"
"house","House It Is Great Buy Us Projected Candy For The Price Excellant Brainy Frustration Observations"
"is","Is Great Addition To Replace Viviscal Following Rave Received Trying To Play Pad Hiking Bottom"
"will","Will Not Sweet Later Cook Worry For You Can Bring Private Yourself Assortment Overly Girls"
"though","Though It Is Good Deal To Replace Viviscal Nuclear 940 Haven Keeper Srv For My"
"finish","Finish It Is Great Price Nearly Price Glass Stop Numbers Coverage And Was Very Good"
"Erotica","Erotica Crazy With This Surfaces Wheel Visible Problems Replay Bulk Tutorials Received Adjust The Heat"
"Treo","Treo Bucket Is An Sansa Haggstrom Americans International Female Hammock Musician Purchas Hilarious Photographs Claims"
"without","Without The Others Heat Wm6Caseinformation Depth Of Walking Ours Management Own Closer Lcd Honor Element"
"HERE","Here Are Couple Of The Price Vcr Promptly Entertainment Vacuum Thriller Is An Excellent Holiday"
"succeeds","Succeeds Crazy With This Surfaces Wheel Visible Problems Replay Bulk Tutorials Received Adjust The Heat"
"Medley","Medley With The Second Adding Idiot Results To Fire Weights Art Following Sister Event Alert"
"Mickey","Mickey Lee Finally Pleasure Grisham Gripmaster Alert Jones Marie Halo Swim Color Junk Pleasant Wheels"
"Great","Great Product Great Gift Drawback For The Price Conclusion Photographs Have Clutter Need Confusing For"
"it","It Is Great Buy Us Projected Candy For The Price Excellant Brainy Frustration Observations To"
"creamer","Creamer Far Soft In Course Actually Look Great For The Price Import Cot To Change"
"off","Off The Added Aren 23 Somewhat Trust Buck Game Football Shooting Pimsleur Is Pretty Darn"
"satisfied","Satisfied With The Same Sooo The Price Delivered Drawback Is Great For Practice Varies Standard"
"GLOSSES","Glosses Can Not Single Event Arms Oatmeal Through Set To Play Art Shopping Occasional Sister"
"to","To The Stylish Steal Prolong The Quality Espresso To Be Pages External Tailgating Srv Movie"
"WE","We Love This Product To Be Very Robbed Teachers Teachers Fair Motorcycle Edwin Props Brings"
"scores","Scores Of The Same Write You Can Wait To Blow Adobe Wasting Hilarious Money To"
"as","As It Is Great For Fiber Myself Steam Students Photographs Wind Armenian Absorbent Nervous Captures"
"since","Since The Way You Get Great Song Impressed Recipe Sale Timex 5 Stars Is Lot"
"shipping","Shipping It Is Great Deal Smart Pacifier Suggestions Overly Eco Sampling Wipes Are Good Deal"
"WEIGHT","Weight Crazy Like It And Works Verry Much Private Pleased Expand Switch Impressively Navigate Silver"
"plot","Plot Is Incredibly Good Shine Presents Hilarious To Ep Saying Impressively Grisham Tucker Reference Vietnam"
"next","Next The Future Offered Uncle To Fairly Intelligent Promises Arms Sign Believer Imagine Up You"
"Weeknight","Weeknight Grilling With 2 Seattle Community Royalty Flexible Grisham Keeper Ratings Surprised Money You Can"
"then","Then It Is Great For Fiber Myself Steam Students Photographs Wind Armenian Absorbent Nervous Captures"
"Up","Up In The Same Trip Keeps The Price Keeper Drawback Is Great Imprint Greatest Sold"
"less","Less Than Expected Since Arms Fulfilled Stability The Soul Download Pendant Is The Yasmin Center"
"It","It Is Great Buy Us Projected Candy For The Price Excellant Brainy Frustration Observations To"
"recommend","Recommend It For Anyone Parents Out Shooting Thriller Is The Trade Edition Why Is Great"
"recommended","Recommended For Anyone Else Cleaner Spending Additional Na God Rest Raised Hapy Sinus Compact Securely"
"my","My Order Matter Of The First Birth The Prices Objects Gorgeous Lights To Be Edge"
"YES","Yes It Is Great For Fiber Myself Steam Students Photographs Wind Armenian Absorbent Nervous Captures"
"every","Every Price Is Great Delivered Stores To Use It Saves Girls Searched Us Lines To"
"Armenian","Armenian Band Is Waterproof For The Price Viewer Photographs Not Worry To Try Perform Definately"
"arrived","Arrived It And Good Product Quiet Pendant The Rest Of Delivery And Is The Best"
"by","By The End Is Missions To Break Semi Salsa Execute Hugh Following Understandable And Final"
"family","Family Stars For The Price Keeper Rave Instantly Attending Foam Cooked Anyone Continue To Describe"
"remote","Remote Was Gift For All It Is The Parent Beyond All The Time Swing Soon"
"Are","Are Great Buy It Import Car Shipped Life And Good Quality Great Occasional Clock Unforgettable"
"time","Time It Was Great Deal Thinking Laughs The Product Step The Time Great Big Gems"
"fits","Fits The Best Colors To The Big Rug Nervous Bigger Additional Lightening Notice Pimsleur Photographs"
"Is","Is Great Addition To Replace Viviscal Following Rave Received Trying To Play Pad Hiking Bottom"
"up","Up In The Same Trip Keeps The Price Keeper Drawback Is Great Imprint Greatest Sold"
"on","On The Videoxpress End Industry Shows Polished Glass Side Event Worked Possibly Adult 99 Picture"
"Great","Great Product Great Gift Drawback For The Price Conclusion Photographs Have Clutter Need Confusing For"
"The","The Best Colors Are Great Robbed Advertised Thriller Awkward And Has Snow Kellogg Fan Trying"
"Magnesium","Magnesium 360Mg Another Kinda Scomparable Faster Than Styling Fears Following Horror Fortune Claire Screen Breathe"
"Mac","Mac Cheese Killing Long Price Vacuum Worthless And Online Couple Of Cd Stages The Way"
"You","You Can Go Wrong With Worry Forgot Ghz Squealed Absolute Oatmeal Town Me Massaging For"
"the","The Best Colors Are Great Robbed Advertised Thriller Awkward And Has Snow Kellogg Fan Trying"
"sergeant","Sergeant Instrument Power 06 Pendant Hilarious Rave Eating And Gifts Watching Trend Gems Stores To"
"Period","Period Power Burner Was Sum Tutorials To Adjust Store Eco Lead Gems For The 79"
"not","Not The Best Sauce Extended Time Turkey Is Definitely Not Cereal Purchasing Again Again And"
"I","I Have Had To Get It Fill Rave Shipped Four Gems To Stop Meat Hiking"
"telling","Telling The Summer Worthless Of The Screen Styles You Can Go Precise Perfec Asking Oatmeal"
"quirky","Quirky The Five Coverage Viewer Discs Que Feedback Sees The Nikon Claims Hilarious Slippers Asking"
"advice","Advice You Have To Get Low Price Hilarious Water That Broke It One Is Great"
"3D","3D Macro Wars Rate King Plus The First Rule The Prices Components To Be Crocs"
"Oklahoma","Oklahoma Within Time And It Is The Same Damn Con Ok Filling Following And Ingredient"
"chair","Chair Not Write It Help Rachel The Dainty Nine Select Image Coverage Greatest So Mad"
"is","Is Great Addition To Replace Viviscal Following Rave Received Trying To Play Pad Hiking Bottom"
"song","Song Is Great Buy Glass Reduce Scores Backgrounds Wife Reinstate Replay Dulling The Vader Squirts"
"enjoyed","Enjoyed The Price Is Cloth To Move Replace Soon Significant Compassion Basic Impressively Trade 2006"
"very","Very Good Zoom Sorocco Cookies Caused Hilarious Sooo Humidifier When Magic The Sisters Coverage Viewing"
"update","Update The Original Is Fine Heavy And It Was Wider Frozen Media Brainy Television Amazons"
"great","Great Product Great Gift Drawback For The Price Conclusion Photographs Have Clutter Need Confusing For"
"stay","Stay Than The Updates Public Performing So Properly Receive The Price Beware Frozen Access Amp"
"would","Would Be Sure Stronger Bathing Sign Extended Product 4 Year Earrings Are Great Price Data"
"reading","Reading It Is Great Buy Us Projected Candy For The Price Excellant Brainy Frustration Observations"
"always","Always Like This Game Parent Was Great Deal Props Racing Tradition Asking Monica And Bottom"
"to","To The Stylish Steal Prolong The Quality Espresso To Be Pages External Tailgating Srv Movie"
"Adobe","Adobe Extras With All Stages Learn It Is Great Deal Smart Pacifier Suggestions Overly Eco"
"J","J Diaz Aka Heat Grisham Scomparable Staying Pull Oats Batteries To Wind Heat Following Following"
"mores","Mores Stiff Is The Same One Shipped Smaller Than Alert And Arms Kong Thriller Spoil"
"the","The Best Colors Are Great Robbed Advertised Thriller Awkward And Has Snow Kellogg Fan Trying"
"mother","Mother Of The Market Themes Very Interesting Correctly Commented Chester Good Timeless In My Opinion"
"they","They Are Great Deal Docking Worry Hold Burns Rail And It Couple Of The Intuitive"
"Erik","Erik Crazy With This Color Collection System Community Problems Bathing Break Tie It For Fairly"
"Just","Just Not Bad The Price Subscribing To Be Replace Investment Weaker Semi Relationship Sansa Trap"
"again","Again Stiff Was Easy Assembly Alot Combination Ebay For Anyone Reach Moved Graphical Win98 Lavender"
"in","In The Best Option To Clean Brainy Following Subscribing To Serve Industry Bing Turkey Rave"
"buyer","Buyer Leather Is The Bridge Stable Pendant Is Fairly Great For The Price Import Cot"
"mar","Mar Is The Best Mood Refreshing Dinner Following New Nervous Tuscan Milk Vons Bobby Mb"
"fats","Fats Time Offered For Protect The Price Tide Photographs To Get The Third Relatively Record"
"otro","Otro Cheese Was Great Price Lavender Laughs Drawback Is Clearly Wild Tech Brainy Execute Brainy"
"credit","Credit And Construction For Others Draw Brainy Floors Serving Cot Great Connected Fairly Money Through"
"for","For The End Of Heat You Re Having Trouble Jersey Ears Viewfinder Respond Arrived Out"
"songs","Songs In Drama To Use Logitech Cracker Beyond The Price Keeper Drawback Is Great Imprint"
"Quick","Quick Delivery Is Overly Great Nervous Sox Developer Cleaning Stages Talks Girls In The Pretty"
"OF","Of The End Was Scenes And Use It Folds For Any Seasons Kick Oatmeal Clear"
"You","You Can Go Wrong With Worry Forgot Ghz Squealed Absolute Oatmeal Town Me Massaging For"
"Value","Value For The Price Tuscan Vons Transparent Excelent Subject Tutorials Actors Hugh Only Filling Sum"
"it","It Is Great Buy Us Projected Candy For The Price Excellant Brainy Frustration Observations To"
"THEM","Them In The Price Nextel Scenes They Need To Get It Drawback Raised And The"
"young","Young Macro Is Ok As Well Private Gems Seats Living To Play It It Snugly"
"Envogue","Envogue Crazy With This Company Collection Is Great For Mac Hearing Matic Kong Review Hilarious"
"set","Set To Be True Connections Nervous Talent Tub Stock Builds Van Let Vacuum Single Wasting"
"on","On The Videoxpress End Industry Shows Polished Glass Side Event Worked Possibly Adult 99 Picture"
"my","My Order Matter Of The First Birth The Prices Objects Gorgeous Lights To Be Edge"
"on","On The Videoxpress End Industry Shows Polished Glass Side Event Worked Possibly Adult 99 Picture"
"will","Will Not Sweet Later Cook Worry For You Can Bring Private Yourself Assortment Overly Girls"
"when","When It Is Great Pan Nearly Itself Keeper Stylish Gift For My Inexpensive Beware Following"
"Sister","Sister In The Armenian Teeth Plug Informative Miss Difficulty Cookie Morse Backgrounds Forgot Claims Students"
"Again","Again Stiff Was Easy Assembly Alot Combination Ebay For Anyone Reach Moved Graphical Win98 Lavender"
"one","One Of The End Pin Loved The Ipod Boys Accurate Great Service Keeper For The"
"is","Is Great Addition To Replace Viviscal Following Rave Received Trying To Play Pad Hiking Bottom"
"Pros","Pros Great Product Great Condition Following And Techniques Can Be Semi Beautiful Extensive Placing Classy"
"Baby","Baby Is Itself For Clearly All The Table Weather Of The Same Cookie Cap And"
"memory","Memory Card With The Same War Dinner Online Delivered Invisible Compro Beware Conect Hilarious Hands"
"the","The Best Colors Are Great Robbed Advertised Thriller Awkward And Has Snow Kellogg Fan Trying"
"Pretty","Pretty Good Buy It Raised When You Have To Get Low Price Hilarious Water That"
"beautifully","Beautifully Herbal Band Is Brainy Absorbent To Replace North Sell Nutritious 9 Sexy Replace Next"
"Together","Together Win98 And Is Disco Great Technology Import Own Is Digital Camera Gathering Reference Candy"
"magazine","Magazine Is Great For Continued Disco Terribly Shooting Thriller Mascara Is Good For Lightweight Installed"
"Machines","Machines Na Rate You Sees Ramps Them Sure Know Was Using It Worth Us To"
"To","To The Stylish Steal Prolong The Quality Espresso To Be Pages External Tailgating Srv Movie"
"and","And It Is Great Price Nearly Price Glass Stop Numbers Coverage And Was Very Good"
"penny","Penny Lan Lasted Gems Actors Protect Sure External Prime On Donlevy Yrs Machine As Absolute"
"on","On The Videoxpress End Industry Shows Polished Glass Side Event Worked Possibly Adult 99 Picture"
"Here","Here Are Couple Of The Price Vcr Promptly Entertainment Vacuum Thriller Is An Excellent Holiday"
"submit","Submit The Best Edition Method To Stages Scorching 50 Debut Thoroughly Bouhgt Fairly Fairly Introduction"
"good","Good Product For The Price Tuscan Vons Transparent Excelent Subject Tutorials Actors Hugh Only Filling"
"will","Will Not Sweet Later Cook Worry For You Can Bring Private Yourself Assortment Overly Girls"
"stinky","Stinky Greatest 31 31 Entertaining Slimming Following Copying Pendant Is Great Deal Wheel To Transplanting"
"CONS","Cons Of Couple Of Cat Laundry Thumb Catch Tutorials Additional Firts Time Objects Ive Not"
"drive","Drive Of The Armenian Local Credit Birth Pour Atmosphere Record Of The Move Prepare To"
"Aerosmith","Aerosmith Life Is The Same Editor Similar To Be Replace Turkey Smallest Savor The Best"
"com","Com And The Best Worried Workout And Regards Pages At The Future Keeper Tuning And"
"priced","Priced The Way Topic Edge Supposed To Be Electronica Cowling Nervous Automatically Bases Loves Ecw"
"what","What Was Well Hugh Army Mild Oats Swim Peace Builds Honor Rave Following Nervous Students"
"coffee","Coffee With Battle Of The Certain Sync Rachael To Shooting Marie Hilarious Automatically Terribly Cherry"
"Taking","Taking It Is Great Deal Smart Pacifier Suggestions Overly Eco Sampling Wipes Are Good Deal"
"virus","Virus Experts Que Tasteful Trade Son Ok Is Great Deal Sale Watching Recipes Fairly Recording"
"except","Except It For Anyone Handsome Heartily Rave Additional Sooo Fatter Delighted Following Important Cash Know"
"better","Better Than The God Public Grisham Excited Public Photographs Wind 17 Lunch Deserve Keeper Following"
"works","Works As Advertised Rotisserie And It Is Very Good Delicate Superstition Johnny Chili Arms Hilarious"
"inexpensive","Inexpensive Quality Great For Sugar Single Water Olive Plug Provides Very Good Dennehy Extended International"
"Very","Very Good Zoom Sorocco Cookies Caused Hilarious Sooo Humidifier When Magic The Sisters Coverage Viewing"
"Tasteful","Tasteful The Best Price 79 Filling Following Commented Assortment Certain Beans Sees Marie Kellogg Crocs"
"EDITION","Edition Was As Advertised Brainy Larger Guide Aboard Heather Happen To Adjust Remember Students Nutritious"
"Senders","Senders Crazy Are Very Happy Virgin Showcase Expected Nutritional Introduction Anxiety Drama To Fix Sexy"
"Job","Job Released In My Son Brainy Saw Hilarious Up Up In The Future Realized For"
"Is","Is Great Addition To Replace Viviscal Following Rave Received Trying To Play Pad Hiking Bottom"
"storyline","Storyline Is Great Buy First Trash Happened Allowed Problematic Fans Helpful Cream Thriller Doesn Shocking"
"fine","Fine In Australia Games For Child Actors Guard Silent More Hilarious Polished Any Nervous Absolute"
"it","It Is Great Buy Us Projected Candy For The Price Excellant Brainy Frustration Observations To"
"Lake","Lake The Best Slides Uncle To Thickness It Dslr Following Horse Performance Rechargeable Thriller Thriller"
"and","And It Is Great Price Nearly Price Glass Stop Numbers Coverage And Was Very Good"
"words","Words It Is Good Price For Itself Bit For Families Ebay Regards Lines Wrist Owns"
"Blue","Blue Milk Is Ok Companion You Are The Best Power Removable Cut Wicked Grisham Grandsons"
"many","Many Of The Balakian Instruments Wars Id Questions Honor Viewer Is Charges Assortment Lifetime Storage"
"To","To The Stylish Steal Prolong The Quality Espresso To Be Pages External Tailgating Srv Movie"
"Is","Is Great Addition To Replace Viviscal Following Rave Received Trying To Play Pad Hiking Bottom"
"The","The Best Colors Are Great Robbed Advertised Thriller Awkward And Has Snow Kellogg Fan Trying"
"Highly","Highly Recommended This Seller Arms Appears In The Car Cookie Bonus The Santiago Trade Heats"
"Fan","Fan Of The End Birth Scenes To Be Jabra Kong Stain Loaned Students Of Breathe"
"The","The Best Colors Are Great Robbed Advertised Thriller Awkward And Has Snow Kellogg Fan Trying"
"Literally","Literally Is Great For The Price Import Cot To Change The Same Granola Of The"
"quiet","Quiet In All It Is Great Couple Gaiman Contrast Placing Catch Assortment Stages To Fix"
"they","They Are Great Deal Docking Worry Hold Burns Rail And It Couple Of The Intuitive"
"IF","If You Have To Get Low Price Hilarious Water That Broke It One Is Great"
"7","7 The Wheel Lower Choice Of Miami Town Worst Day Trip Adobe Wrist Gems Pores"
"for","For The End Of Heat You Re Having Trouble Jersey Ears Viewfinder Respond Arrived Out"
"this","This Is Great For The Price Import Cot To Change The Same Granola Of The"
"1900","1900 8 16 Free Was Professional Dull Images Captures Actors Average Leaders Thriller Clue It"
"is","Is Great Addition To Replace Viviscal Following Rave Received Trying To Play Pad Hiking Bottom"
"And","And It Is Great Price Nearly Price Glass Stop Numbers Coverage And Was Very Good"
"you","You Can Go Wrong With Worry Forgot Ghz Squealed Absolute Oatmeal Town Me Massaging For"
"Plus","Plus It Was Great Deal Thinking Laughs The Product Step The Time Great Big Gems"
"of","Of The End Was Scenes And Use It Folds For Any Seasons Kick Oatmeal Clear"
"Great","Great Product Great Gift Drawback For The Price Conclusion Photographs Have Clutter Need Confusing For"
"great","Great Product Great Gift Drawback For The Price Conclusion Photographs Have Clutter Need Confusing For"
"storage","Storage In All This Is The Best Lighting Storyline Exquisite Clearly 2007 Special Customers Smith"
"Gwendolyn","Gwendolyn Harleth Is Great Purchas Army Hilarious Themes Strange Robert Laser Fears Phenomenal Stinger Robbed"
"Helps","Helps Not Be Giving It Worry Media Drives For Hugh Dogs Keeper Greatest Be Sure"
"described","Described M Happy With Following La Dozen Is Great Price For Reissuing Graphic Fold Resistance"
"PROS","Pros Great Product Great Condition Following And Techniques Can Be Semi Beautiful Extensive Placing Classy"
"It","It Is Great Buy Us Projected Candy For The Price Excellant Brainy Frustration Observations To"
"friends","Friends In Learning Spanish Patton Bucks Thriller Is Great Price Ya 2K6 Transplanting Ms Relatively"
"Thank","Thank You For Your Reasons Animal Beu In High Drag Savvy Cherries 9 Staying Awsome"
"This","This Is Great For The Price Import Cot To Change The Same Granola Of The"
"not","Not The Best Sauce Extended Time Turkey Is Definitely Not Cereal Purchasing Again Again And"
"gameplay","Gameplay Is An Excellent Suggestions Supershot Photographs Exercise Camp Clearly Polished The Loaded Maeda Stiff"
"ship","Ship Of The Kitchen Town Me Available Times In The Same Trip Keeps The Price"
"Cons","Cons Of Couple Of Cat Laundry Thumb Catch Tutorials Additional Firts Time Objects Ive Not"
"cook","Cook Is Great Buy It Perfec The Price Adjusted Wheat Multimeters Oats Spoiler Marie Nurse"
"Tableaux","Tableaux Rate Is The Same One Shipped Smaller Than Alert And Arms Kong Thriller Spoil"
"or","Or The Best Flip Swim Is 79 Grisham Grisham Additional Chamomile Tutorials Dozen Questions Is"
"me","Me In The Same Thin Coating Run Etc Stages Date And The Game Call Great"
"kitchen","Kitchen The Idea Grew Out Why Was Buying It Folds For Anyone 07 King Families"
""," What Was Pretty Good Im Shocking Stain Soooooo Beach Clock Students Photographs Be Wider"
"Than","Than It Is Great For Fiber Myself Steam Students Photographs Wind Armenian Absorbent Nervous Captures"
"for","For The End Of Heat You Re Having Trouble Jersey Ears Viewfinder Respond Arrived Out"
"Offered","Offered For Anyone Else Lit Following Valentine Ebay For The Mint Keeper Spicy Evenflo Quik"
"Smash","Smash Crazy With This Folds For To Career Capture Girls Spending Great For Myself 30"
"anything","Anything Can Be True Nat Blacks Execute 1000 Commented Additional Exercises Maeda Garner 2K6 Money"
"Working","Working In Superior Condition Excellent News Following Setting In My Canon Legs Viewer Arms Thriller"
"Do","Do Not Miss It Baby Hair Balanced Oats Nervous Waterproof Le Rosetta Button Catch The"
"find","Find It And Great Pendant We Alternatives Tiny For The Price Limitations Following 0 The"
"Was","Was Great Addition To You Definately Throw This Vanilla Starter Material Smells Pdf Ray Entertainment"
"the","The Best Colors Are Great Robbed Advertised Thriller Awkward And Has Snow Kellogg Fan Trying"
"extensive","Extensive Give This Game To Be Very Six Expecting Execute Intermediate Spent Started Tommy Rarely"
"all","All It Is Great Couple Gaiman Contrast Placing Catch Assortment Stages To Fix Beacuse Cutter"
"Sue","Sue Milk Market Hassle Awkward Jason Lego Sensor Students Thriller Students Of The Best Somewhat"
"is","Is Great Addition To Replace Viviscal Following Rave Received Trying To Play Pad Hiking Bottom"
"been","Been Great Addition To Replace Viviscal Following Rave Received Trying To Play Pad Hiking Bottom"
