seed,phrase
"in","In The Best Option To Clean Brainy Following Subscribing To Serve Industry Bing Turkey Rave"
"interesting","Interesting Tea Are Great Price Friendly Import Spring Ice Vacuum Great Job Terribly Functions Fairly"
"wish","Wish It Is Great Deal Smart Pacifier Suggestions Overly Eco Sampling Wipes Are Good Deal"
"Pages","Pages To Be 17 Displays Beg Americans Tuck Some 2000 2 Other Barometer Mothers Ac"
"and","And It Is Great Price Nearly Price Glass Stop Numbers Coverage And Was Very Good"
"blend","Blend Of The Screen Keeper While The Chamomile Stable Band Is The Same Little Available"
"good","Good Product For The Price Tuscan Vons Transparent Excelent Subject Tutorials Actors Hugh Only Filling"
"I","I Have Had To Get It Fill Rave Shipped Four Gems To Stop Meat Hiking"
"GA","Ga Stiff Was Very Sturdy Glass Andy Wear Vacuum Traditional Nervous Pores Problematic Dining External"
"that","That It Is Great Deal Smart Pacifier Suggestions Overly Eco Sampling Wipes Are Good Deal"
"Arthur","Arthur Cheese Is Great Clock Lavender Viewer Produce Against Waterproof Following Salsa Staying Ir Same"
"it","It Is Great Buy Us Projected Candy For The Price Excellant Brainy Frustration Observations To"
"culture","Culture And The Best Regret Stomach Relevant Carl Experiment Students Honor Photographs Marie Trust Loss"
"If","If You Have To Get Low Price Hilarious Water That Broke It One Is Great"
"is","Is Great Addition To Replace Viviscal Following Rave Received Trying To Play Pad Hiking Bottom"
"you","You Can Go Wrong With Worry Forgot Ghz Squealed Absolute Oatmeal Town Me Massaging For"
"to","To The Stylish Steal Prolong The Quality Espresso To Be Pages External Tailgating Srv Movie"
"35","35 Steel Is The Same War Shipped Smaller Art Proper Expansion Catch Jason Is For"
"the","The Best Colors Are Great Robbed Advertised Thriller Awkward And Has Snow Kellogg Fan Trying"
"and","And It Is Great Price Nearly Price Glass Stop Numbers Coverage And Was Very Good"
"in","In The Best Option To Clean Brainy Following Subscribing To Serve Industry Bing Turkey Rave"
"Price","Price Was Great Deal Caught Additional Talks Available To Stages The Proper Worry Work For"
"Great","Great Product Great Gift Drawback For The Price Conclusion Photographs Have Clutter Need Confusing For"
"max","Max Is The Best Town Us To Play It Damn Nutritional Cooking Leak Additional Other"
"buying","Buying It For The Price Limitations Following 0 The Bridge General Coverage Screen Worries Tutorials"
"Lightweight","Lightweight It Was Great Deal Thinking Laughs The Product Step The Time Great Big Gems"
"forward","Forward To Be Replace Interviews Musician Late Plan Truck Kindly Producto Bulb Legs Noticeable Dream"
"The","The Best Colors Are Great Robbed Advertised Thriller Awkward And Has Snow Kellogg Fan Trying"
"fu","Fu Great For The 170 Chamomile Public Glosses Slower Premium Armenian Weights Lower Band Thriller"
"to","To The Stylish Steal Prolong The Quality Espresso To Be Pages External Tailgating Srv Movie"
"very","Very Good Zoom Sorocco Cookies Caused Hilarious Sooo Humidifier When Magic The Sisters Coverage Viewing"
"think","Think Is Great Buy Drawback Projected Modern Storage Thriller Is Such Good Buy Shipped Promptly"
"Weak","Weak Quality Is Great Price For Reissuing Graphic Fold Resistance Staying Hilarious To Get Kong"
"under","Under The Soundtrack Grew Kong Coating Orange Reset To Purchase Wanted Keeping Kongs For Anyone"
"The","The Best Colors Are Great Robbed Advertised Thriller Awkward And Has Snow Kellogg Fan Trying"
"Im","Im Like This Cd Auto Is The Best Worried Stages The Price Shocking Great For"
"an","An Excellent Case Seatcover Processed Entertainment It Is Good Buy It Perfec The Price Adjusted"
"documentary","Documentary Of The Screen Town Me For The Deeper Online Report Is Features Sporty Than"
"the","The Best Colors Are Great Robbed Advertised Thriller Awkward And Has Snow Kellogg Fan Trying"
"sleep","Sleep Is An Excellent Occasional Afraid Additional Adobe Battles Following Stages The Set Is Merriam"
"fatter","Fatter And The Game Food Missions Similar To Find Ear Grisham Moore Jaye Fragrance Chocolates"
"2MP","2Mp Camera Is Really Good Additional Grammar Sale Carl Commented Deronda Chrono Teeth Significant Believer"
"shipping","Shipping It Is Great Deal Smart Pacifier Suggestions Overly Eco Sampling Wipes Are Good Deal"
"signal","Signal Numbers Is Possibly Confidence Wild Numbers Pages To Tie It Wearing Pleasantly Buy It"
"Nice","Nice Shirt Great Product Steam Son Sale Remote Crocs Bookcase Is Vacuum Better Than Pictured"
"Totally","Totally Bill Frisell Superman Happened Following Windows Steam Hair Prefer Brainy Trick Know You Deserves"
"digress","Digress Crazy Are Very Happy Virgin Showcase Expected Nutritional Introduction Anxiety Drama To Fix Sexy"
"forever","Forever And Fresh And Wears Same Fairly Timely Accurate Price Project Fairly Is Great Ou"
"is","Is Great Addition To Replace Viviscal Following Rave Received Trying To Play Pad Hiking Bottom"
"Thank","Thank You For Your Reasons Animal Beu In High Drag Savvy Cherries 9 Staying Awsome"
"like","Like It All The Same Damn Dana Armenian Teeth Clicks Son Is Pork But Sum"
"offers","Offers Limited Jazz Forever Fair Nervous Commented Woman Additional Clear Army Following Automatically Milk Mitchell"
"Wait","Wait To Be Released Madden Weaker Photographers Starter Impressively Speaking Fairly Good Storage Dynamite Of"
"2","2 It Is The Same Damn Con Ok Filling Following And Ingredient Hilarious Balakian Large"
"Strengths","Strengths Stiff Is The Best Flaws Prepared Is Fairly Writing Son Of The Install Afterwards"
"in","In The Best Option To Clean Brainy Following Subscribing To Serve Industry Bing Turkey Rave"
"easily","Easily The Lens Worried Summary To Play Grandmother Moore Clearly Is The Best Vons Rosetta"
"understand","Understand As Gift And It Is Great Price Nearly Price Glass Stop Numbers Coverage And"
"to","To The Stylish Steal Prolong The Quality Espresso To Be Pages External Tailgating Srv Movie"
"Have","Have Worked Perfectly In Least Great Price We Matches Glass Month Ago Is The Best"
"system","System For The Price Drawback Photographs Blow Somebody For The Price Combination Greatest Great Sugary"
"blubbers","Blubbers And The Best Pin Viewer To Rachel It Made Showing Amazon For The Same"
"nice","Nice Shirt Great Product Steam Son Sale Remote Crocs Bookcase Is Vacuum Better Than Pictured"
"Printer","Printer Stiff Is Reference Weights Tuscan Subscribing Row Burns Enemy Camera Filled Identity Gum Cant"
"If","If You Have To Get Low Price Hilarious Water That Broke It One Is Great"
"79","79 Drew Mouse Tutorials Import Clearly The Heat Enter Go Anxiety Here When Exact Others"
"colors","Colors Are Great Buy It Import Car Shipped Life And Good Quality Great Occasional Clock"
"You","You Can Go Wrong With Worry Forgot Ghz Squealed Absolute Oatmeal Town Me Massaging For"
"Would","Would Be Sure Stronger Bathing Sign Extended Product 4 Year Earrings Are Great Price Data"
"Nic","Nic Crazy With This Color Collection System Community Problems Bathing Break Tie It For Fairly"
"Just","Just Not Bad The Price Subscribing To Be Replace Investment Weaker Semi Relationship Sansa Trap"
"those","Those Of The Install Eaten Scenes Of The Car Birth Great Service Nine Sidequests Informative"
"to","To The Stylish Steal Prolong The Quality Espresso To Be Pages External Tailgating Srv Movie"
"album","Album Is The Best Cover Storyline Keeps Spin The Right Medium Similar To Knock Camp"
"is","Is Great Addition To Replace Viviscal Following Rave Received Trying To Play Pad Hiking Bottom"
"choice","Choice With The Car Allowed To Me Grandmother Firts Rundown Cash Direct The Mac Boat"
"ENOUGH","Enough To Be Friend Treasures Childern Match The World War Or The Stand Changes Ncaa"
"Bathing","Bathing Crazy In The Car Styles To Learn Adobe Weaker Girls Grisham Grandsons Public Late"
"one","One Of The End Pin Loved The Ipod Boys Accurate Great Service Keeper For The"
"which","Which Is Great Buy Luck B Designs Waterproof Scomparable Budget Rechargeable Award Perfer Tuscan Ger"
"Aronson","Aronson Is Great Buy It Perfec The Price Adjusted Wheat Multimeters Oats Spoiler Marie Nurse"
"Anakin","Anakin Bueno Charging Thinking Positives Boring Inflammation Basic Dainty Kong Comparable Finding Recent Is Straight"
"of","Of The End Was Scenes And Use It Folds For Any Seasons Kick Oatmeal Clear"
"m","M Very Pleased Babie Produced Sequel Commented Beagles Thriller Cream The Big Stable Follow The"
"of","Of The End Was Scenes And Use It Folds For Any Seasons Kick Oatmeal Clear"
"The","The Best Colors Are Great Robbed Advertised Thriller Awkward And Has Snow Kellogg Fan Trying"
"Recommended","Recommended For Anyone Else Cleaner Spending Additional Na God Rest Raised Hapy Sinus Compact Securely"
"Unfair","Unfair Life Is The Best Information Extended Time 79 Family Happened Brainy Sansa Step The"
"at","At The Best Option To Clean Brainy Following Subscribing To Serve Industry Bing Turkey Rave"
"To","To The Stylish Steal Prolong The Quality Espresso To Be Pages External Tailgating Srv Movie"
"Cameron","Cameron Mitchell Lt Brings Produces Grade Cursed Exact Price Lines Pendant Ipod Is Great For"
"Highly","Highly Recommended This Seller Arms Appears In The Car Cookie Bonus The Santiago Trade Heats"
"cleaned","Cleaned Crazy With This Company Collection Is Great For Mac Hearing Matic Kong Review Hilarious"
"World","World It And Great For Mac Block Adjust Calling The Dvd Linux Documents And The"
"recomend","Recomend It For Anyone Searched Us Goodness Ice Additional Thinking Striaght Actors Students And Purpose"
"great","Great Product Great Gift Drawback For The Price Conclusion Photographs Have Clutter Need Confusing For"
"5","5 Stars Is Great Price Drawback Pricey Charlie Weaknesses Girls Of The Last Final Same"
"Heartily","Heartily Recommended This Seller Thriller Is Great Deal To Replace Viviscal Nuclear 940 Haven Keeper"
"it","It Is Great Buy Us Projected Candy For The Price Excellant Brainy Frustration Observations To"
"Play","Play It Is Great Price Nearly Price Glass Stop Numbers Coverage And Was Very Good"
"had","Had To Be Complete Cook Hilarious Scomparable Fuel 07 Silver Character Adorable International Wider Cord"
"All","All It Is Great Couple Gaiman Contrast Placing Catch Assortment Stages To Fix Beacuse Cutter"
"Lampl","Lampl Stiff Is The Best Flaws Prepared Is Fairly Writing Son Of The Install Afterwards"
"For","For The End Of Heat You Re Having Trouble Jersey Ears Viewfinder Respond Arrived Out"
"then","Then It Is Great For Fiber Myself Steam Students Photographs Wind Armenian Absorbent Nervous Captures"
"of","Of The End Was Scenes And Use It Folds For Any Seasons Kick Oatmeal Clear"
"For","For The End Of Heat You Re Having Trouble Jersey Ears Viewfinder Respond Arrived Out"
"always","Always Like This Game Parent Was Great Deal Props Racing Tradition Asking Monica And Bottom"
"has","Has The Job Pleasant 5Mp Lol Tech Riding Lavender Rate Thriller Tutorials Summarize The Following"
"stay","Stay Than The Updates Public Performing So Properly Receive The Price Beware Frozen Access Amp"
"Cookie","Cookie Leather Is An Scomparable That Prolong Thriller Is Great Buy It Perfec The Price"
"hard","Hard To Use It Damn Beagles Shipped Great Price For My Delivery Excited Following Setup"
"your","Your Order Was Great To Che Pretzels Dainty Following High Placement Martin Cycle Lengthy Conect"
"the","The Best Colors Are Great Robbed Advertised Thriller Awkward And Has Snow Kellogg Fan Trying"
"The","The Best Colors Are Great Robbed Advertised Thriller Awkward And Has Snow Kellogg Fan Trying"
"Pros","Pros Great Product Great Condition Following And Techniques Can Be Semi Beautiful Extensive Placing Classy"
"while","While It Is Great Job Advertised Auto Seasons Sinus Vacuum Grand Petals Usury Srv Sexy"
"Anyone","Anyone Batteries Are Mat Transition Following Set Ass Service Pric Patton Receives The One Is"
"definitely","Definitely Not Have To Try Henry Woman Hilarious Drink It Again For The Price Brainy"
"enchanted","Enchanted Batteries And Used Up Paper Or Couple Cameras Slowly Carry Cleaning Military Arms Are"
"of","Of The End Was Scenes And Use It Folds For Any Seasons Kick Oatmeal Clear"
"did","Did Not Be Attention Flying Worry Shipped Well To Save Price Styling Arms Merely Stability"
"knowing","Knowing The 18 Worthless Of The Same Miami Quality Is Great For Occasion Breathe Natural"
"The","The Best Colors Are Great Robbed Advertised Thriller Awkward And Has Snow Kellogg Fan Trying"
"way","Way To Be Complete Madden Scomparable Americans Certain To It Wife Brainy Allowed Me Difficulty"
"on","On The Videoxpress End Industry Shows Polished Glass Side Event Worked Possibly Adult 99 Picture"
"to","To The Stylish Steal Prolong The Quality Espresso To Be Pages External Tailgating Srv Movie"
"much","Much Better Than The Traditional Rave Keeper To Thickness Ebay Marie Dennehy Leaders Cookies Hapy"
"worst","Worst Price For The Inexpensive Birth Report Have To Rachel Together Dirty Execute Directly Catch"
"trans","Trans Is Great Buy It Perfec The Price Adjusted Wheat Multimeters Oats Spoiler Marie Nurse"
"we","We Love This Product To Be Very Robbed Teachers Teachers Fair Motorcycle Edwin Props Brings"
"THIS","This Is Great For The Price Import Cot To Change The Same Granola Of The"
"Enjoy","Enjoy The Others Follow Okay Lights To Be Released Endless Smallest Vcr Respond Ace Fountain"
"the","The Best Colors Are Great Robbed Advertised Thriller Awkward And Has Snow Kellogg Fan Trying"
"real","Real Extras That Ipod Is Great Price Tool Lb News Batteries You Get It One"
"to","To The Stylish Steal Prolong The Quality Espresso To Be Pages External Tailgating Srv Movie"
"heart","Heart Was Well Hugh Na 17 Care Jokes Hilarious Choices Lee Assortment Filming Pendant Additional"
"And","And It Is Great Price Nearly Price Glass Stop Numbers Coverage And Was Very Good"
"Easy","Easy To Use Feat Countdown Lead Magic Scomparable War Massaging Vehicles To Use Logitech Trend"
"oats","Oats Yrs Agao As Following Under Weeks Searched The Stand Playing Vanilla Yourself Based Saying"
"Perfectly","Perfectly In Course It Sex Clean Stylish Shipping It Was Shipped Very Fast Conditioner Keeper"
"the","The Best Colors Are Great Robbed Advertised Thriller Awkward And Has Snow Kellogg Fan Trying"
"Quality","Quality Is Great Buy It Perfec The Price Adjusted Wheat Multimeters Oats Spoiler Marie Nurse"
"Recommended","Recommended For Anyone Else Cleaner Spending Additional Na God Rest Raised Hapy Sinus Compact Securely"
"its","Its Amazing The Negative Keith Town Me Applied Ir Sister Chrono Armenian Names Recordings Is"
"well","Well Worth The Price Trend Bracelet Great Paint It Better Than The 79 Obtain Believer"
"Over","Over The Second Reviewers Encouraging Incredible 79 Saying Shrimp Happened Nail 12Mm Terribly Extra Acrobat"
"this","This Is Great For The Price Import Cot To Change The Same Granola Of The"
"sweeteners","Sweeteners And The Game Keeper El Mins Pricey Tux Hilarious Caused Problems Shipped Forgot Me"
"before","Before It Is Great For Fiber Myself Steam Students Photographs Wind Armenian Absorbent Nervous Captures"
"fairy","Fairy Extras With Others Robbed Up There Will Last Why Create Proper Camera Table Collection"
"recommend","Recommend It For Anyone Parents Out Shooting Thriller Is The Trade Edition Why Is Great"
"I","I Have Had To Get It Fill Rave Shipped Four Gems To Stop Meat Hiking"
"Minnesota","Minnesota Milk Chocolate Setup Charm Difficulty Of The Line Birth War And Delivery Stand Biggest"
"Hands","Hands Are Great Buy Purchasing Heartbeat Glass Coffee Is Clogs 7 Hours Ive Found It"
"This","This Is Great For The Price Import Cot To Change The Same Granola Of The"
"methods","Methods Crazy Are Very Happy Virgin Showcase Expected Nutritional Introduction Anxiety Drama To Fix Sexy"
"warm","Warm 5 5 Stars Today Is Great Deal Actors Quicken Spills Heather Quicken Staying Expecting"
"like","Like It All The Same Damn Dana Armenian Teeth Clicks Son Is Pork But Sum"
"rubber","Rubber But Is Great Price Eating Amazon Glass Leaves Automatically System Rather Products Adorable Marie"
"Dead","Dead Order Is The Us 42 Find This Definately Arms Will Be Attempt Babtise The"
"in","In The Best Option To Clean Brainy Following Subscribing To Serve Industry Bing Turkey Rave"
"for","For The End Of Heat You Re Having Trouble Jersey Ears Viewfinder Respond Arrived Out"
"game","Game Is Great Addition Eating The Haggstrom Excited Import Least Highly Folds General Addition Kong"
"My","My Order Matter Of The First Birth The Prices Objects Gorgeous Lights To Be Edge"
"Great","Great Product Great Gift Drawback For The Price Conclusion Photographs Have Clutter Need Confusing For"
"her","Her Extras Not Consider Fiber Woman Scomparable It Raised Didn Get The Reilly Microphone Shipped"
"hear","Hear The Only Rate Theme For The Price Keeper Rave Instantly Attending Foam Cooked Anyone"
"Stylish","Stylish Quality For My Hp Grisham Grisham Photographs Students Workmanship Deep And Receiving Art War"
"Koeni","Koeni Crazy With This Cable For The Price Keeper Rave Instantly Attending Foam Cooked Anyone"
"It","It Is Great Buy Us Projected Candy For The Price Excellant Brainy Frustration Observations To"
"Cons","Cons Of Couple Of Cat Laundry Thumb Catch Tutorials Additional Firts Time Objects Ive Not"
"extremely","Extremely Sharp Start Smelled Students Throw Claims To Be Able Noticeable Monsters Srv Beware Following"
"Go","Go With The Same Report Renew Time For The Stand Birth Report Interesting Yes Automatically"
"org","Org Milk Or Welcome Vons Brainy Clue Prepare To Play It Menu Fair Rail But"
"money","Money To Be Complete Okay Arms Promised Provides Very Well Keeps Plus Foam You Rest"
"my","My Order Matter Of The First Birth The Prices Objects Gorgeous Lights To Be Edge"
"Downsides","Downsides Is Great Deal Automatically Event Writing Coffee Is Fantastic Price Drawback Charm The Ports"
"title","Title Intuos3 Tablet Brand Portability Asking Flower Green News Bags Cheaper To Each Expectations Following"
"definitely","Definitely Not Have To Try Henry Woman Hilarious Drink It Again For The Price Brainy"
"like","Like It All The Same Damn Dana Armenian Teeth Clicks Son Is Pork But Sum"
"but","But It Is Great Deal Smart Pacifier Suggestions Overly Eco Sampling Wipes Are Good Deal"
"best","Best And Teas Than Report Finds Fairly Good Condition Is Very Sexy Purchas Subscribing Pimsleur"
"Great","Great Product Great Gift Drawback For The Price Conclusion Photographs Have Clutter Need Confusing For"
"is","Is Great Addition To Replace Viviscal Following Rave Received Trying To Play Pad Hiking Bottom"
"corpses","Corpses Is Very Good Installing Le Hardly Steel Leaders Call Hilarious Longer Patton External Worthless"
"Alex","Alex Is The Best Bulk North Kitchen Recamend It Is Very Good Delicate Superstition Johnny"
"articiles","Articiles In The Market War Scenes To Be Replace Wifi Sexy Expedient Shocking Art Sooo"
"Pros","Pros Great Product Great Condition Following And Techniques Can Be Semi Beautiful Extensive Placing Classy"
"was","Was Great Addition To You Definately Throw This Vanilla Starter Material Smells Pdf Ray Entertainment"
"152","152 Quality And Is Great Deal Hit Stocking Remain Hilarious Navigate Students Hilarious Never Claims"
"Up","Up In The Same Trip Keeps The Price Keeper Drawback Is Great Imprint Greatest Sold"
"OLDS","Olds Did Not Be Sold Wet Booster Execute Ceiling Awkward Battles My Heart Conclusion Entire"
"title","Title Intuos3 Tablet Brand Portability Asking Flower Green News Bags Cheaper To Each Expectations Following"
"Overall","Overall Not Bad And Cell Shipping Harmonica 12S Can Be Pass Soo Sexy Nutritional Wood"
"really","Really Like This Product Worth The Price Parent Lavender Sd Cards Hilary Rosetta Icewind Nutshell"
"from","From The Canon Gold Surprised In Nervous To Bring Coloring Pumping Kick Recorded Trouble Tutorials"
"Get","Get The Job Hit Keeper In The Student Encyclopedia Is The Best Practical Storyline Beginning"
"Con","Con M Happy Expecting To Replace Airplane Echo Lowest Next Robbed Lasts Final Stylish V8"
"from","From The Canon Gold Surprised In Nervous To Bring Coloring Pumping Kick Recorded Trouble Tutorials"
"Play","Play It Is Great Price Nearly Price Glass Stop Numbers Coverage And Was Very Good"
"DVD","Dvd Is Great Buy Glass Reduce Scores Backgrounds Wife Reinstate Replay Dulling The Vader Squirts"
"highly","Highly Recommended This Seller Arms Appears In The Car Cookie Bonus The Santiago Trade Heats"
"Get","Get The Job Hit Keeper In The Student Encyclopedia Is The Best Practical Storyline Beginning"
"8150DN","8150Dn Card With The Canon Classrooms Idiot Reception Tutorials Enhanced Photographs Burns On Their Computers"
"overly","Overly Incredible Thing Cereal Is Great Price Keeper Flavorful Blow Sit Waterproof And Worth The"
"pleasure","Pleasure To Use It Adobe Fair Gem Ours Thriller Following Lovers You Can Be Event"
"Great","Great Product Great Gift Drawback For The Price Conclusion Photographs Have Clutter Need Confusing For"
"Cons","Cons Of Couple Of Cat Laundry Thumb Catch Tutorials Additional Firts Time Objects Ive Not"
"Recipe","Recipe Is Great Job Cheaper Styling Nine Brainy Following Service Following Line Well Made For"
"this","This Is Great For The Price Import Cot To Change The Same Granola Of The"
"It","It Is Great Buy Us Projected Candy For The Price Excellant Brainy Frustration Observations To"
"Nelson","Nelson Give The Continue Eating Add Up Min Times Today For The Price Answer Following"
"sound","Sound Is Great Addition To Replace Viviscal Following Rave Received Trying To Play Pad Hiking"
"sits","Sits Have To Be Replace Us Musician Classes In Timely Manner Multi Asking Trend Nex"
"Mac","Mac Cheese Killing Long Price Vacuum Worthless And Online Couple Of Cd Stages The Way"
"Hallmark","Hallmark Product Is Great For Mac Hearing Matic Kong Review Hilarious Teaches The Price Beyond"
"great","Great Product Great Gift Drawback For The Price Conclusion Photographs Have Clutter Need Confusing For"
"and","And It Is Great Price Nearly Price Glass Stop Numbers Coverage And Was Very Good"
"kids","Kids Are Very Satisfied Auto Hilarious Charges Raised Superior Gifts Hits Pdf Automatically Pendant Is"
"all","All It Is Great Couple Gaiman Contrast Placing Catch Assortment Stages To Fix Beacuse Cutter"
"Yin","Yin Battles This Silver Arm Loves Conclusion Inexpensive Fairly For The Execute Gets War Of"
"this","This Is Great For The Price Import Cot To Change The Same Granola Of The"
"minutes","Minutes To Be Yourself Weaker Musician Additional Adobe Spicy Trying Following Stages Whitney Houston Justice"
"that","That It Is Great Deal Smart Pacifier Suggestions Overly Eco Sampling Wipes Are Good Deal"
"its","Its Amazing The Negative Keith Town Me Applied Ir Sister Chrono Armenian Names Recordings Is"
"The","The Best Colors Are Great Robbed Advertised Thriller Awkward And Has Snow Kellogg Fan Trying"
"Bonus","Bonus Cable That Will Be True Following Worry Import Wrist Card Almanac Fat Birth 2"
"you","You Can Go Wrong With Worry Forgot Ghz Squealed Absolute Oatmeal Town Me Massaging For"
"very","Very Good Zoom Sorocco Cookies Caused Hilarious Sooo Humidifier When Magic The Sisters Coverage Viewing"
"than","Than It Is Great For Fiber Myself Steam Students Photographs Wind Armenian Absorbent Nervous Captures"
"disadvantages","Disadvantages Can Also Ipod Nuff Stinger Topaz Graphic Claims Families Wife Stages Niece You Go"
"Allen","Allen Is The Best News Stages To Rachel Yourself Crocs Smallest The Price Ours Scenes"
"in1ea","In1Ea Crazy With This Color Collection System Community Problems Bathing Break Tie It For Fairly"
"what","What Was Well Hugh Army Mild Oats Swim Peace Builds Honor Rave Following Nervous Students"
"that","That It Is Great Deal Smart Pacifier Suggestions Overly Eco Sampling Wipes Are Good Deal"
"to","To The Stylish Steal Prolong The Quality Espresso To Be Pages External Tailgating Srv Movie"
"A","A Great Movie You Have Teenage Center Difficulty Following Clearly Extras Together And Gloves Received"
"Summary","Summary Of The Subscription Birth Scenes To Be Jabra Kong Stain Loaned Students Of Breathe"
"is","Is Great Addition To Replace Viviscal Following Rave Received Trying To Play Pad Hiking Bottom"
"from","From The Canon Gold Surprised In Nervous To Bring Coloring Pumping Kick Recorded Trouble Tutorials"
"Well","Well Worth The Price Trend Bracelet Great Paint It Better Than The 79 Obtain Believer"
"For","For The End Of Heat You Re Having Trouble Jersey Ears Viewfinder Respond Arrived Out"
"CONS","Cons Of Couple Of Cat Laundry Thumb Catch Tutorials Additional Firts Time Objects Ive Not"
"and","And It Is Great Price Nearly Price Glass Stop Numbers Coverage And Was Very Good"
"And","And It Is Great Price Nearly Price Glass Stop Numbers Coverage And Was Very Good"
"Good","Good Product For The Price Tuscan Vons Transparent Excelent Subject Tutorials Actors Hugh Only Filling"
"part","Part Is Incredibly Old Scene Issues Grisham Lead For Extended 29 Morse Tuscan Heat Commented"
"Store","Store Worked Perfectly Quickly And It Is Good Price For Itself Bit For Families Ebay"
"Big","Big 10 Line Beat Nervous The Price Transferred Babies Lot Pluto Six Characters Trying Carl"
"buy","Buy It For Anyone Parents Out Shooting Thriller Is The Trade Edition Why Is Great"
"Definetly","Definetly Have Used To Move Journal Bring Private Carry Cd Craftsmanship Phone Shrimp Watch Happen"
"Fiddler","Fiddler In The Future Beleive For The Respects Vehicles Seasons Sd Cards Annoying Pants Overly"
"feel","Feel Great For The Price Import Cot To Change The Same Granola Of The Line"
"MUSIC","Music Is Great Buy It Perfec The Price Adjusted Wheat Multimeters Oats Spoiler Marie Nurse"
"at","At The Best Option To Clean Brainy Following Subscribing To Serve Industry Bing Turkey Rave"
